pa,pp,ta,tp
the admon goalted the astroph .,the astroph was goalted by the admon .,a boy joins a brother .,a brother is joined by a boy .
a predec goalts an admon .,an admon is goalted by a predec .,the brother joined the buddy .,the buddy was joined by the brother .
a photograp dupled a commemor .,a commemor was dupled by a photograp .,the buddy joins the candidate .,the candidate is joined by the buddy .
the congreg filibs the simultane .,the simultane is filibed by the congreg .,a candidate joined a captain .,a captain was joined by a candidate .
the admon fingerted the astroph .,the astroph was fingerted by the admon .,a captain joins a champion .,a champion is joined by a captain .
a neoc mosquits a davidjl .,a davidjl is mosquited by a neoc .,the champion joined the chief .,the chief was joined by the champion .
a surrog discled a chirop .,a chirop was discled by a surrog .,the chief joins the child .,the child is joined by the chief .
the conspic veterins the abbre .,the abbre is veterined by the conspic .,a child joined a colonel .,a colonel was joined by a child .
the jurisd filibed the congreg .,the congreg was filibed by the jurisd .,a colonel joins a cop .,a cop is joined by a colonel .
a dilig filibs a whistlebl .,a whistlebl is filibed by a dilig .,the cop joined the cousin .,the cousin was joined by the cop .
a bacter ethned a consolid .,a consolid was ethned by a bacter .,the cousin joins the daughter .,the daughter is joined by the cousin .
the gluc discls the malf .,the malf is discled by the gluc .,a daughter joined a doctor .,a doctor was joined by a daughter .
the chimpan calibred the disreg .,the disreg was calibred by the chimpan .,a doctor joins an employee .,an employee is joined by a doctor .
a disg discls a confid .,a confid is discled by a disg .,the employee joined the employer .,the employer was joined by the employee .
a mism goalted a microbi .,a microbi was goalted by a mism .,the employer joins the father .,the father is joined by the employer .
the neurot celebrs the mism .,the mism is celebred by the neurot .,a father joined a friend .,a friend was joined by a father .
the davidjl impovered the conspic .,the conspic was impovered by the davidjl .,a friend joins a girl .,a girl is joined by a friend .
a consolid reapps a predomin .,a predomin is reapped by a consolid .,the girl joined the guest .,the guest was joined by the girl .
a photograp multifed a commemor .,a commemor was multifed by a photograp .,the guest joins the guy .,the guy is joined by the guest .
the astroph celebrs the abund .,the abund is celebred by the astroph .,a guy joined a hero .,a hero was joined by a guy .
the dispers ferved the gluc .,the gluc was ferved by the dispers .,a hero joins a husband .,a husband is joined by a hero .
a dissu discls a jurisd .,a jurisd is discled by a dissu .,the husband joined the kid .,the kid was joined by the husband .
an abbre indiscrimed a sidx .,a sidx was indiscrimed by an abbre .,the kid joins the king .,the king is joined by the kid .
the conspic mosquits the abbre .,the abbre is mosquited by the conspic .,a king joined a lady .,a lady was joined by a king .
the nont dupled the membr .,the membr was dupled by the nont .,a lady joins a lawyer .,a lawyer is joined by a lady .
a conting subters a consecut .,a consecut is subtered by a conting .,the lawyer joined the leader .,the leader was joined by the lawyer .
a mism calibred a microbi .,a microbi was calibred by a mism .,the leader joins the man .,the man is joined by the leader .
the astroph discls the abund .,the abund is discled by the astroph .,a man joined a manager .,a manager was joined by a man .
the confid calibed the neurot .,the neurot was calibed by the confid .,a manager joins a mayor .,a mayor is joined by a manager .
a coer nonds a cryptoc .,a cryptoc is nonded by a coer .,the mayor joined the minister .,the minister was joined by the mayor .
a bacter helicoped a consolid .,a consolid was helicoped by a bacter .,the minister joins the mother .,the mother is joined by the minister .
the outper dupls the bellig .,the bellig is dupled by the outper .,a mother joined a nurse .,a nurse was joined by a mother .
the contag indiscrimed the disag .,the disag was indiscrimed by the contag .,a nurse joins a parent .,a parent is joined by a nurse .
a microbi goalts a femin .,a femin is goalted by a microbi .,the parent joined the partner .,the partner was joined by the parent .
a neglig calibed a dissu .,a dissu was calibed by a neglig .,the partner joins the physician .,the physician is joined by the partner .
the burgl murms the certific .,the certific is murmed by the burgl .,a physician joined a pilot .,a pilot was joined by a physician .
the whistlebl multifed the hairst .,the hairst was multifed by the whistlebl .,a pilot joins a president .,a president is joined by a pilot .
an accommod nonds an ausp .,an ausp is nonded by an accommod .,the president joined the priest .,the priest was joined by the president .
a fluct hambed a kilomet .,a kilomet was hambed by a fluct .,the priest joins the prince .,the prince is joined by the priest .
the barric goalts the restruct .,the restruct is goalted by the barric .,a prince joined a princess .,a princess was joined by a prince .
the chimpan sulfed the disreg .,the disreg was sulfed by the chimpan .,a princess joins a professor .,a professor is joined by a princess .
a sidx calibs a contag .,a contag is calibed by a sidx .,the professor joined the reader .,the reader was joined by the professor .
a neglig biomarked a dissu .,a dissu was biomarked by a neglig .,the reader joins the scientist .,the scientist is joined by the reader .
the membr subters the canv .,the canv is subtered by the membr .,a scientist joined a secretary .,a secretary was joined by a scientist .
the admon worshed the astroph .,the astroph was worshed by the admon .,a secretary joins a sheriff .,a sheriff is joined by a secretary .
a disg sulfs a confid .,a confid is sulfed by a disg .,the sheriff joined the singer .,the singer was joined by the sheriff .
a restruct fingerted a carcin .,a carcin was fingerted by a restruct .,the singer joins the soldier .,the soldier is joined by the singer .
the astroph fervs the abund .,the abund is ferved by the astroph .,a soldier joined a son .,a son was joined by a soldier .
the jurisd depled the congreg .,the congreg was depled by the jurisd .,a son joins a student .,a student is joined by a son .
a consolid impovers a predomin .,a predomin is impovered by a consolid .,the student joined the teacher .,the teacher was joined by the student .
a mism murmed a microbi .,a microbi was murmed by a mism .,the teacher joins the uncle .,the uncle is joined by the teacher .
the extrater contrads the surrog .,the surrog is contraded by the extrater .,an uncle joined a wife .,a wife was joined by an uncle .
the nont multifed the membr .,the membr was multifed by the nont .,a wife joins a winner .,a winner is joined by a wife .
a coer impovers a cryptoc .,a cryptoc is impovered by a coer .,the winner joined the woman .,the woman was joined by the winner .
a canv carnived a siph .,a siph was carnived by a canv .,the woman joins the worker .,the worker is joined by the woman .
the hairst contrads the bacter .,the bacter is contraded by the hairst .,a worker joined a writer .,a writer was joined by a worker .
the femin handced the collabor .,the collabor was handced by the femin .,a writer joins an actor .,an actor is joined by a writer .
a dissu fervs a jurisd .,a jurisd is ferved by a dissu .,the actor judged the actress .,the actress was judged by the actor .
a fluct multifed a kilomet .,a kilomet was multifed by a fluct .,the actress judges the adult .,the adult is judged by the actress .
the outper murms the bellig .,the bellig is murmed by the outper .,an adult judged an attorney .,an attorney was judged by an adult .
the cryptoc helicoped the burgl .,the burgl was helicoped by the cryptoc .,an attorney judges an aunt .,an aunt is judged by an attorney .
an accommod dupls an ausp .,an ausp is dupled by an accommod .,the aunt judged the author .,the author was judged by the aunt .
a bacter handced a consolid .,a consolid was handced by a bacter .,the author judges the bishop .,the bishop is judged by the author .
the congreg smirs the simultane .,the simultane is smired by the congreg .,a bishop judged a boy .,a boy was judged by a bishop .
the attribut calibred the extrater .,the extrater was calibred by the attribut .,a boy judges a brother .,a brother is judged by a boy .
a kilomet veterins a pedd .,a pedd is veterined by a kilomet .,the brother judged the buddy .,the buddy was judged by the brother .
an abund filibed an accommod .,an accommod was filibed by an abund .,the buddy judges the candidate .,the candidate is judged by the buddy .
the outper smirs the bellig .,the bellig is smired by the outper .,a candidate judged a captain .,a captain was judged by a candidate .
the pedd hambed the barric .,the barric was hambed by the pedd .,a captain judges a champion .,a champion is judged by a captain .
a sidx veterins a contag .,a contag is veterined by a sidx .,the champion judged the chief .,the chief was judged by the champion .
a disqual ethned a neoc .,a neoc was ethned by a disqual .,the chief judges the child .,the child is judged by the chief .
the cripp indiscrims the fluct .,the fluct is indiscrimed by the cripp .,a child judged a colonel .,a colonel was judged by a child .
the davidjl filibed the conspic .,the conspic was filibed by the davidjl .,a colonel judges a cop .,a cop is judged by a colonel .
a kilomet discls a pedd .,a pedd is discled by a kilomet .,the cop judged the cousin .,the cousin was judged by the cop .
a malf subtered a disg .,a disg was subtered by a malf .,the cousin judges the daughter .,the daughter is judged by the cousin .
the neurot multifs the mism .,the mism is multifed by the neurot .,a daughter judged a doctor .,a doctor was judged by a daughter .
the dispers celebred the gluc .,the gluc was celebred by the dispers .,a doctor judges an employee .,an employee is judged by a doctor .
a neoc ethns a davidjl .,a davidjl is ethned by a neoc .,the employee judged the employer .,the employer was judged by the employee .
a fluct handced a kilomet .,a kilomet was handced by a fluct .,the employer judges the father .,the father is judged by the employer .
the astroph calibs the abund .,the abund is calibed by the astroph .,a father judged a friend .,a friend was judged by a father .
the pedd handced the barric .,the barric was handced by the pedd .,a friend judges a girl .,a girl is judged by a friend .
an accommod veterins an ausp .,an ausp is veterined by an accommod .,the girl judged the guest .,the guest was judged by the girl .
a malf biomarked a disg .,a disg was biomarked by a malf .,the guest judges the guy .,the guy is judged by the guest .
the barric handcs the restruct .,the restruct is handced by the barric .,a guy judged a hero .,a hero was judged by a guy .
the pedd contamined the barric .,the barric was contamined by the pedd .,a hero judges a husband .,a husband is judged by a hero .
a chirop celebrs a nont .,a nont is celebred by a chirop .,the husband judged the kid .,the kid was judged by the husband .
a bellig subtered a coer .,a coer was subtered by a bellig .,the kid judges the king .,the king is judged by the kid .
the conspic multifs the abbre .,the abbre is multifed by the conspic .,a king judged a lady .,a lady was judged by a king .
the ausp powded the outper .,the outper was powded by the ausp .,a lady judges a lawyer .,a lawyer is judged by a lady .
a siph dupls a dispers .,a dispers is dupled by a siph .,the lawyer judged the leader .,the leader was judged by the lawyer .
a fluct sulfed a kilomet .,a kilomet was sulfed by a fluct .,the leader judges the man .,the man is judged by the leader .
the burgl nonds the certific .,the certific is nonded by the burgl .,a man judged a manager .,a manager was judged by a man .
the nont depled the membr .,the membr was depled by the nont .,a manager judges a mayor .,a mayor is judged by a manager .
a siph impovers a dispers .,a dispers is impovered by a siph .,the mayor judged the minister .,the minister was judged by the mayor .
a malf impovered a disg .,a disg was impovered by a malf .,the minister judges the mother .,the mother is judged by the minister .
the extrater calibrs the surrog .,the surrog is calibred by the extrater .,a mother judged a nurse .,a nurse was judged by a mother .
the attribut carnived the extrater .,the extrater was carnived by the attribut .,a nurse judges a parent .,a parent is judged by a nurse .
a sidx impovers a contag .,a contag is impovered by a sidx .,the parent judged the partner .,the partner was judged by the parent .
a simultane hambed a dilig .,a dilig was hambed by a simultane .,the partner judges the physician .,the physician is judged by the partner .
the astroph worshs the abund .,the abund is worshed by the astroph .,a physician judged a pilot .,a pilot was judged by a physician .
the davidjl biomarked the conspic .,the conspic was biomarked by the davidjl .,a pilot judges a president .,a president is judged by a pilot .
a microbi smirs a femin .,a femin is smired by a microbi .,the president judged the priest .,the priest was judged by the president .
a surrog depled a chirop .,a chirop was depled by a surrog .,the priest judges the prince .,the prince is judged by the priest .
the disag mosquits the detrim .,the detrim is mosquited by the disag .,a prince judged a princess .,a princess was judged by a prince .
the chimpan nonded the disreg .,the disreg was nonded by the chimpan .,a princess judges a professor .,a professor is judged by a princess .
a neoc clusts a davidjl .,a davidjl is clusted by a neoc .,the professor judged the reader .,the reader was judged by the professor .
a fluct worshed a kilomet .,a kilomet was worshed by a fluct .,the reader judges the scientist .,the scientist is judged by the reader .
the disbel worshs the photograp .,the photograp is worshed by the disbel .,a scientist judged a secretary .,a secretary was judged by a scientist .
the femin celebred the collabor .,the collabor was celebred by the femin .,a secretary judges a sheriff .,a sheriff is judged by a secretary .
a neoc filibs a davidjl .,a davidjl is filibed by a neoc .,the sheriff judged the singer .,the singer was judged by the sheriff .
an abund multifed an accommod .,an accommod was multifed by an abund .,the singer judges the soldier .,the soldier is judged by the singer .
the membr helicops the canv .,the canv is helicoped by the membr .,a soldier judged a son .,a son was judged by a soldier .
the pedd multifed the barric .,the barric was multifed by the pedd .,a son judges a student .,a student is judged by a son .
a predec celebrs an admon .,an admon is celebred by a predec .,the student judged the teacher .,the teacher was judged by the student .
a canv calibred a siph .,a siph was calibred by a canv .,the teacher judges the uncle .,the uncle is judged by the teacher .
the collabor worshs the neglig .,the neglig is worshed by the collabor .,an uncle judged a wife .,a wife was judged by an uncle .
the jurisd dupled the congreg .,the congreg was dupled by the jurisd .,a wife judges a winner .,a winner is judged by a wife .
a siph handcs a dispers .,a dispers is handced by a siph .,the winner judged the woman .,the woman was judged by the winner .
a bacter indiscrimed a consolid .,a consolid was indiscrimed by a bacter .,the woman judges the worker .,the worker is judged by the woman .
the membr sulfs the canv .,the canv is sulfed by the membr .,a worker judged a writer .,a writer was judged by a worker .
the admon calibed the astroph .,the astroph was calibed by the admon .,a writer judges an actor .,an actor is judged by a writer .
a neoc murms a davidjl .,a davidjl is murmed by a neoc .,the actor carried the actress .,the actress was carried by the actor .
an abund dupled an accommod .,an accommod was dupled by an abund .,the actress carries the adult .,the adult is carried by the actress .
the extrater worshs the surrog .,the surrog is worshed by the extrater .,an adult carried an attorney .,an attorney was carried by an adult .
the davidjl indiscrimed the conspic .,the conspic was indiscrimed by the davidjl .,an attorney carries an aunt .,an aunt is carried by an attorney .
a chirop fingerts a nont .,a nont is fingerted by a chirop .,the aunt carried the author .,the author was carried by the aunt .
an abbre powded a sidx .,a sidx was powded by an abbre .,the author carries the bishop .,the bishop is carried by the author .
the extrater biomarks the surrog .,the surrog is biomarked by the extrater .,a bishop carried a boy .,a boy was carried by a bishop .
the nont impovered the membr .,the membr was impovered by the nont .,a boy carries a brother .,a brother is carried by a boy .
a chirop subters a nont .,a nont is subtered by a chirop .,the brother carried the buddy .,the buddy was carried by the brother .
a certific calibed a conting .,a conting was calibed by a certific .,the buddy carries the candidate .,the candidate is carried by the buddy .
the burgl veterins the certific .,the certific is veterined by the burgl .,a candidate carried a captain .,a captain was carried by a candidate .
the predomin multifed the disbel .,the disbel was multifed by the predomin .,a captain carries a champion .,a champion is carried by a captain .
a microbi handcs a femin .,a femin is handced by a microbi .,the champion carried the chief .,the chief was carried by the champion .
a detrim impovered a predec .,a predec was impovered by a detrim .,the chief carries the child .,the child is carried by the chief .
the extrater goalts the surrog .,the surrog is goalted by the extrater .,a child carried a colonel .,a colonel was carried by a child .
the ausp handced the outper .,the outper was handced by the ausp .,a colonel carries a cop .,a cop is carried by a colonel .
a predec clusts an admon .,an admon is clusted by a predec .,the cop carried the cousin .,the cousin was carried by the cop .
a restruct worshed a carcin .,a carcin was worshed by a restruct .,the cousin carries the daughter .,the daughter is carried by the cousin .
the disbel mosquits the photograp .,the photograp is mosquited by the disbel .,a daughter carried a doctor .,a doctor was carried by a daughter .
the femin biomarked the collabor .,the collabor was biomarked by the femin .,a doctor carries an employee .,an employee is carried by a doctor .
a coer subters a cryptoc .,a cryptoc is subtered by a coer .,the employee carried the employer .,the employer was carried by the employee .
a canv discled a siph .,a siph was discled by a canv .,the employer carries the father .,the father is carried by the employer .
the disreg goalts the disqual .,the disqual is goalted by the disreg .,a father carried a friend .,a friend was carried by a father .
the confid veterined the neurot .,the neurot was veterined by the confid .,a friend carries a girl .,a girl is carried by a friend .
a microbi ethns a femin .,a femin is ethned by a microbi .,the girl carried the guest .,the guest was carried by the girl .
a canv sulfed a siph .,a siph was sulfed by a canv .,the guest carries the guy .,the guy is carried by the guest .
the extrater carnivs the surrog .,the surrog is carnived by the extrater .,a guy carried a hero .,a hero was carried by a guy .
the predomin ferved the disbel .,the disbel was ferved by the predomin .,a hero carries a husband .,a husband is carried by a hero .
a chirop calibrs a nont .,a nont is calibred by a chirop .,the husband carried the kid .,the kid was carried by the husband .
a bellig hambed a coer .,a coer was hambed by a bellig .,the kid carries the king .,the king is carried by the kid .
the disbel powds the photograp .,the photograp is powded by the disbel .,a king carried a lady .,a lady was carried by a king .
the admon carnived the astroph .,the astroph was carnived by the admon .,a lady carries a lawyer .,a lawyer is carried by a lady .
a microbi veterins a femin .,a femin is veterined by a microbi .,the lawyer carried the leader .,the leader was carried by the lawyer .
a mism ethned a microbi .,a microbi was ethned by a mism .,the leader carries the man .,the man is carried by the leader .
the congreg carnivs the simultane .,the simultane is carnived by the congreg .,a man carried a manager .,a manager was carried by a man .
the cryptoc mosquited the burgl .,the burgl was mosquited by the cryptoc .,a manager carries a mayor .,a mayor is carried by a manager .
a predec subters an admon .,an admon is subtered by a predec .,the mayor carried the minister .,the minister was carried by the mayor .
a mism worshed a microbi .,a microbi was worshed by a mism .,the minister carries the mother .,the mother is carried by the minister .
the conspic fingerts the abbre .,the abbre is fingerted by the conspic .,a mother carried a nurse .,a nurse was carried by a mother .
the whistlebl calibed the hairst .,the hairst was calibed by the whistlebl .,a nurse carries a parent .,a parent is carried by a nurse .
a sidx powds a contag .,a contag is powded by a sidx .,the parent carried the partner .,the partner was carried by the parent .
a restruct celebred a carcin .,a carcin was celebred by a restruct .,the partner carries the physician .,the physician is carried by the partner .
the neurot calibrs the mism .,the mism is calibred by the neurot .,a physician carried a pilot .,a pilot was carried by a physician .
the admon discled the astroph .,the astroph was discled by the admon .,a pilot carries a president .,a president is carried by a pilot .
an accommod calibs an ausp .,an ausp is calibed by an accommod .,the president carried the priest .,the priest was carried by the president .
a canv clusted a siph .,a siph was clusted by a canv .,the priest carries the prince .,the prince is carried by the priest .
the outper impovers the bellig .,the bellig is impovered by the outper .,a prince carried a princess .,a princess was carried by a prince .
the attribut clusted the extrater .,the extrater was clusted by the attribut .,a princess carries a professor .,a professor is carried by a princess .
a sidx indiscrims a contag .,a contag is indiscrimed by a sidx .,the professor carried the reader .,the reader was carried by the professor .
a fluct clusted a kilomet .,a kilomet was clusted by a fluct .,the reader carries the scientist .,the scientist is carried by the reader .
the burgl handcs the certific .,the certific is handced by the burgl .,a scientist carried a secretary .,a secretary was carried by a scientist .
the confid contraded the neurot .,the neurot was contraded by the confid .,a secretary carries a sheriff .,a sheriff is carried by a secretary .
a predec dupls an admon .,an admon is dupled by a predec .,the sheriff carried the singer .,the singer was carried by the sheriff .
a detrim contamined a predec .,a predec was contamined by a detrim .,the singer carries the soldier .,the soldier is carried by the singer .
the hairst depls the bacter .,the bacter is depled by the hairst .,a soldier carried a son .,a son was carried by a soldier .
the femin smired the collabor .,the collabor was smired by the femin .,a son carries a student .,a student is carried by a son .
a neoc carnivs a davidjl .,a davidjl is carnived by a neoc .,the student carried the teacher .,the teacher was carried by the student .
a bellig contraded a coer .,a coer was contraded by a bellig .,the teacher carries the uncle .,the uncle is carried by the teacher .
the collabor veterins the neglig .,the neglig is veterined by the collabor .,an uncle carried a wife .,a wife was carried by an uncle .
the nont reapped the membr .,the membr was reapped by the nont .,a wife carries a winner .,a winner is carried by a wife .
a consolid powds a predomin .,a predomin is powded by a consolid .,the winner carried the woman .,the woman was carried by the winner .
an abbre handced a sidx .,a sidx was handced by an abbre .,the woman carries the worker .,the worker is carried by the woman .
the neurot contamins the mism .,the mism is contamined by the neurot .,a worker carried a writer .,a writer was carried by a worker .
the predomin depled the disbel .,the disbel was depled by the predomin .,a writer carries an actor .,an actor is carried by a writer .
a chirop clusts a nont .,a nont is clusted by a chirop .,the actor caught the actress .,the actress was caught by the actor .
a malf goalted a disg .,a disg was goalted by a malf .,the actress catches the adult .,the adult is caught by the actress .
the outper powds the bellig .,the bellig is powded by the outper .,an adult caught an attorney .,an attorney was caught by an adult .
the admon biomarked the astroph .,the astroph was biomarked by the admon .,an attorney catches an aunt .,an aunt is caught by an attorney .
a dissu calibrs a jurisd .,a jurisd is calibred by a dissu .,the aunt caught the author .,the author was caught by the aunt .
a mism filibed a microbi .,a microbi was filibed by a mism .,the author catches the bishop .,the bishop is caught by the author .
the conspic reapps the abbre .,the abbre is reapped by the conspic .,a bishop caught a boy .,a boy was caught by a bishop .
the davidjl contraded the conspic .,the conspic was contraded by the davidjl .,a boy catches a brother .,a brother is caught by a boy .
a coer sulfs a cryptoc .,a cryptoc is sulfed by a coer .,the brother caught the buddy .,the buddy was caught by the brother .
a fluct powded a kilomet .,a kilomet was powded by a fluct .,the buddy catches the candidate .,the candidate is caught by the buddy .
the cripp ethns the fluct .,the fluct is ethned by the cripp .,a candidate caught a captain .,a captain was caught by a candidate .
