pa,pp,ta,tp
a chirop indiscrims a nont .,a nont is indiscrimed by a chirop .,the actor asked the actress .,the actress was asked by the actor .
a restruct indiscrimed a carcin .,a carcin was indiscrimed by a restruct .,the actress asks the adult .,the adult is asked by the actress .
the astroph murms the abund .,the abund is murmed by the astroph .,an adult asked an attorney .,an attorney was asked by an adult .
the jurisd handced the congreg .,the congreg was handced by the jurisd .,an attorney asks an aunt .,an aunt is asked by an attorney .
a coer depls a cryptoc .,a cryptoc is depled by a coer .,the aunt asked the author .,the author was asked by the aunt .
a neglig discled a dissu .,a dissu was discled by a neglig .,the author asks the bishop .,the bishop is asked by the author .
the disreg hambs the disqual .,the disqual is hambed by the disreg .,a bishop asked a boy .,a boy was asked by a bishop .
the contag biomarked the disag .,the disag was biomarked by the contag .,a boy asks a brother .,a brother is asked by a boy .
a disg fervs a confid .,a confid is ferved by a disg .,the brother asked the buddy .,the buddy was asked by the brother .
a mism powded a microbi .,a microbi was powded by a mism .,the buddy asks the candidate .,the candidate is asked by the buddy .
the cripp carnivs the fluct .,the fluct is carnived by the cripp .,a candidate asked a captain .,a captain was asked by a candidate .
the chimpan fingerted the disreg .,the disreg was fingerted by the chimpan .,a captain asks a champion .,a champion is asked by a captain .
a kilomet filibs a pedd .,a pedd is filibed by a kilomet .,the champion asked the chief .,the chief was asked by the champion .
an abbre biomarked a sidx .,a sidx was biomarked by an abbre .,the chief asks the child .,the child is asked by the chief .
the cripp nonds the fluct .,the fluct is nonded by the cripp .,a child asked a colonel .,a colonel was asked by a child .
the ausp smired the outper .,the outper was smired by the ausp .,a colonel asks a cop .,a cop is asked by a colonel .
a conting powds a consecut .,a consecut is powded by a conting .,the cop asked the cousin .,the cousin was asked by the cop .
a detrim subtered a predec .,a predec was subtered by a detrim .,the cousin asks the daughter .,the daughter is asked by the cousin .
the conspic fervs the abbre .,the abbre is ferved by the conspic .,a daughter asked a doctor .,a doctor was asked by a daughter .
the jurisd calibed the congreg .,the congreg was calibed by the jurisd .,a doctor asks an employee .,an employee is asked by a doctor .
a kilomet calibrs a pedd .,a pedd is calibred by a kilomet .,the employee asked the employer .,the employer was asked by the employee .
a fluct veterined a kilomet .,a kilomet was veterined by a fluct .,the employer asks the father .,the father is asked by the employer .
the gluc reapps the malf .,the malf is reapped by the gluc .,a father asked a friend .,a friend was asked by a father .
the jurisd helicoped the congreg .,the congreg was helicoped by the jurisd .,a friend asks a girl .,a girl is asked by a friend .
a kilomet goalts a pedd .,a pedd is goalted by a kilomet .,the girl asked the guest .,the guest was asked by the girl .
an abund powded an accommod .,an accommod was powded by an abund .,the guest asks the guy .,the guy is asked by the guest .
the disreg biomarks the disqual .,the disqual is biomarked by the disreg .,a guy asked a hero .,a hero was asked by a guy .
the nont murmed the membr .,the membr was murmed by the nont .,a hero asks a husband .,a husband is asked by a hero .
an accommod smirs an ausp .,an ausp is smired by an accommod .,the husband asked the kid .,the kid was asked by the husband .
a simultane contraded a dilig .,a dilig was contraded by a simultane .,the kid asks the king .,the king is asked by the kid .
the disreg calibs the disqual .,the disqual is calibed by the disreg .,a king asked a lady .,a lady was asked by a king .
the chimpan contamined the disreg .,the disreg was contamined by the chimpan .,a lady asks a lawyer .,a lawyer is asked by a lady .
a sidx carnivs a contag .,a contag is carnived by a sidx .,the lawyer asked the leader .,the leader was asked by the lawyer .
an abund calibed an accommod .,an accommod was calibed by an abund .,the leader asks the man .,the man is asked by the leader .
the collabor filibs the neglig .,the neglig is filibed by the collabor .,a man asked a manager .,a manager was asked by a man .
the ausp worshed the outper .,the outper was worshed by the ausp .,a manager asks a mayor .,a mayor is asked by a manager .
a dissu subters a jurisd .,a jurisd is subtered by a dissu .,the mayor asked the minister .,the minister was asked by the mayor .
a neglig reapped a dissu .,a dissu was reapped by a neglig .,the minister asks the mother .,the mother is asked by the minister .
the membr depls the canv .,the canv is depled by the membr .,a mother asked a nurse .,a nurse was asked by a mother .
the cryptoc veterined the burgl .,the burgl was veterined by the cryptoc .,a nurse asks a parent .,a parent is asked by a nurse .
a sidx contamins a contag .,a contag is contamined by a sidx .,the parent asked the partner .,the partner was asked by the parent .
a neglig smired a dissu .,a dissu was smired by a neglig .,the partner asks the physician .,the physician is asked by the partner .
the disreg smirs the disqual .,the disqual is smired by the disreg .,a physician asked a pilot .,a pilot was asked by a physician .
the pedd ethned the barric .,the barric was ethned by the pedd .,a pilot asks a president .,a president is asked by a pilot .
a siph hambs a dispers .,a dispers is hambed by a siph .,the president asked the priest .,the priest was asked by the president .
a canv murmed a siph .,a siph was murmed by a canv .,the priest asks the prince .,the prince is asked by the priest .
the membr handcs the canv .,the canv is handced by the membr .,a prince asked a princess .,a princess was asked by a prince .
the whistlebl discled the hairst .,the hairst was discled by the whistlebl .,a princess asks a professor .,a professor is asked by a princess .
a predec biomarks an admon .,an admon is biomarked by a predec .,the professor asked the reader .,the reader was asked by the professor .
a photograp ethned a commemor .,a commemor was ethned by a photograp .,the reader asks the scientist .,the scientist is asked by the reader .
the congreg calibrs the simultane .,the simultane is calibred by the congreg .,a scientist asked a secretary .,a secretary was asked by a scientist .
the confid calibred the neurot .,the neurot was calibred by the confid .,a secretary asks a sheriff .,a sheriff is asked by a secretary .
a neoc hambs a davidjl .,a davidjl is hambed by a neoc .,the sheriff asked the singer .,the singer was asked by the sheriff .
a neglig impovered a dissu .,a dissu was impovered by a neglig .,the singer asks the soldier .,the soldier is asked by the singer .
the collabor fervs the neglig .,the neglig is ferved by the collabor .,a soldier asked a son .,a son was asked by a soldier .
the confid goalted the neurot .,the neurot was goalted by the confid .,a son asks a student .,a student is asked by a son .
a microbi sulfs a femin .,a femin is sulfed by a microbi .,the student asked the teacher .,the teacher was asked by the student .
an abund carnived an accommod .,an accommod was carnived by an abund .,the teacher asks the uncle .,the uncle is asked by the teacher .
the barric mosquits the restruct .,the restruct is mosquited by the barric .,an uncle asked a wife .,a wife was asked by an uncle .
the ausp reapped the outper .,the outper was reapped by the ausp .,a wife asks a winner .,a winner is asked by a wife .
a carcin impovers an attribut .,an attribut is impovered by a carcin .,the winner asked the woman .,the woman was asked by the winner .
a detrim calibred a predec .,a predec was calibred by a detrim .,the woman asks the worker .,the worker is asked by the woman .
the membr impovers the canv .,the canv is impovered by the membr .,a worker asked a writer .,a writer was asked by a worker .
the ausp murmed the outper .,the outper was murmed by the ausp .,a writer asks an actor .,an actor is asked by a writer .
an accommod contrads an ausp .,an ausp is contraded by an accommod .,the actor bothered the actress .,the actress was bothered by the actor .
a surrog powded a chirop .,a chirop was powded by a surrog .,the actress bothers the adult .,the adult is bothered by the actress .
the astroph dupls the abund .,the abund is dupled by the astroph .,an adult bothered an attorney .,an attorney was bothered by an adult .
the predomin reapped the disbel .,the disbel was reapped by the predomin .,an attorney bothers an aunt .,an aunt is bothered by an attorney .
a disg filibs a confid .,a confid is filibed by a disg .,the aunt bothered the author .,the author was bothered by the aunt .
a mism dupled a microbi .,a microbi was dupled by a mism .,the author bothers the bishop .,the bishop is bothered by the author .
the hairst nonds the bacter .,the bacter is nonded by the hairst .,a bishop bothered a boy .,a boy was bothered by a bishop .
the dispers carnived the gluc .,the gluc was carnived by the dispers .,a boy bothers a brother .,a brother is bothered by a boy .
a siph worshs a dispers .,a dispers is worshed by a siph .,the brother bothered the buddy .,the buddy was bothered by the brother .
a detrim fingerted a predec .,a predec was fingerted by a detrim .,the buddy bothers the candidate .,the candidate is bothered by the buddy .
the gluc goalts the malf .,the malf is goalted by the gluc .,a candidate bothered a captain .,a captain was bothered by a candidate .
the femin contraded the collabor .,the collabor was contraded by the femin .,a captain bothers a champion .,a champion is bothered by a captain .
a consolid subters a predomin .,a predomin is subtered by a consolid .,the champion bothered the chief .,the chief was bothered by the champion .
an abbre ferved a sidx .,a sidx was ferved by an abbre .,the chief bothers the child .,the child is bothered by the chief .
the membr multifs the canv .,the canv is multifed by the membr .,a child bothered a colonel .,a colonel was bothered by a child .
the cryptoc contamined the burgl .,the burgl was contamined by the cryptoc .,a colonel bothers a cop .,a cop is bothered by a colonel .
a chirop biomarks a nont .,a nont is biomarked by a chirop .,the cop bothered the cousin .,the cousin was bothered by the cop .
a neglig depled a dissu .,a dissu was depled by a neglig .,the cousin bothers the daughter .,the daughter is bothered by the cousin .
the astroph fingerts the abund .,the abund is fingerted by the astroph .,a daughter bothered a doctor .,a doctor was bothered by a daughter .
the admon handced the astroph .,the astroph was handced by the admon .,a doctor bothers an employee .,an employee is bothered by a doctor .
a kilomet indiscrims a pedd .,a pedd is indiscrimed by a kilomet .,the employee bothered the employer .,the employer was bothered by the employee .
a simultane filibed a dilig .,a dilig was filibed by a simultane .,the employer bothers the father .,the father is bothered by the employer .
the collabor mosquits the neglig .,the neglig is mosquited by the collabor .,a father bothered a friend .,a friend was bothered by a father .
the confid contamined the neurot .,the neurot was contamined by the confid .,a friend bothers a girl .,a girl is bothered by a friend .
a chirop filibs a nont .,a nont is filibed by a chirop .,the girl bothered the guest .,the guest was bothered by the girl .
an abund discled an accommod .,an accommod was discled by an abund .,the guest bothers the guy .,the guy is bothered by the guest .
the burgl powds the certific .,the certific is powded by the burgl .,a guy bothered a hero .,a hero was bothered by a guy .
the chimpan mosquited the disreg .,the disreg was mosquited by the chimpan .,a hero bothers a husband .,a husband is bothered by a hero .
a dissu nonds a jurisd .,a jurisd is nonded by a dissu .,the husband bothered the kid .,the kid was bothered by the husband .
an abund smired an accommod .,an accommod was smired by an abund .,the kid bothers the king .,the king is bothered by the kid .
the disreg filibs the disqual .,the disqual is filibed by the disreg .,a king bothered a lady .,a lady was bothered by a king .
the jurisd contraded the congreg .,the congreg was contraded by the jurisd .,a lady bothers a lawyer .,a lawyer is bothered by a lady .
a disg goalts a confid .,a confid is goalted by a disg .,the lawyer bothered the leader .,the leader was bothered by the lawyer .
a photograp helicoped a commemor .,a commemor was helicoped by a photograp .,the leader bothers the man .,the man is bothered by the leader .
the collabor calibrs the neglig .,the neglig is calibred by the collabor .,a man bothered a manager .,a manager was bothered by a man .
the pedd subtered the barric .,the barric was subtered by the pedd .,a manager bothers a mayor .,a mayor is bothered by a manager .
a siph nonds a dispers .,a dispers is nonded by a siph .,the mayor bothered the minister .,the minister was bothered by the mayor .
a restruct handced a carcin .,a carcin was handced by a restruct .,the minister bothers the mother .,the mother is bothered by the minister .
the cripp smirs the fluct .,the fluct is smired by the cripp .,a mother bothered a nurse .,a nurse was bothered by a mother .
the ausp filibed the outper .,the outper was filibed by the ausp .,a nurse bothers a parent .,a parent is bothered by a nurse .
a carcin powds an attribut .,an attribut is powded by a carcin .,the parent bothered the partner .,the partner was bothered by the parent .
a disqual clusted a neoc .,a neoc was clusted by a disqual .,the partner bothers the physician .,the physician is bothered by the partner .
the hairst fingerts the bacter .,the bacter is fingerted by the hairst .,a physician bothered a pilot .,a pilot was bothered by a physician .
the davidjl ferved the conspic .,the conspic was ferved by the davidjl .,a pilot bothers a president .,a president is bothered by a pilot .
a consolid calibrs a predomin .,a predomin is calibred by a consolid .,the president bothered the priest .,the priest was bothered by the president .
an abbre helicoped a sidx .,a sidx was helicoped by an abbre .,the priest bothers the prince .,the prince is bothered by the priest .
the gluc helicops the malf .,the malf is helicoped by the gluc .,a prince bothered a princess .,a princess was bothered by a prince .
the attribut sulfed the extrater .,the extrater was sulfed by the attribut .,a princess bothers a professor .,a professor is bothered by a princess .
a commemor fingerts a chimpan .,a chimpan is fingerted by a commemor .,the professor bothered the reader .,the reader was bothered by the professor .
a disqual indiscrimed a neoc .,a neoc was indiscrimed by a disqual .,the reader bothers the scientist .,the scientist is bothered by the reader .
the neurot dupls the mism .,the mism is dupled by the neurot .,a scientist bothered a secretary .,a secretary was bothered by a scientist .
the pedd murmed the barric .,the barric was murmed by the pedd .,a secretary bothers a sheriff .,a sheriff is bothered by a secretary .
a kilomet impovers a pedd .,a pedd is impovered by a kilomet .,the sheriff bothered the singer .,the singer was bothered by the sheriff .
a certific veterined a conting .,a conting was veterined by a certific .,the singer bothers the soldier .,the soldier is bothered by the singer .
the extrater sulfs the surrog .,the surrog is sulfed by the extrater .,a soldier bothered a son .,a son was bothered by a soldier .
the confid subtered the neurot .,the neurot was subtered by the confid .,a son bothers a student .,a student is bothered by a son .
a carcin dupls an attribut .,an attribut is dupled by a carcin .,the student bothered the teacher .,the teacher was bothered by the student .
a simultane goalted a dilig .,a dilig was goalted by a simultane .,the teacher bothers the uncle .,the uncle is bothered by the teacher .
the hairst biomarks the bacter .,the bacter is biomarked by the hairst .,an uncle bothered a wife .,a wife was bothered by an uncle .
the femin goalted the collabor .,the collabor was goalted by the femin .,a wife bothers a winner .,a winner is bothered by a wife .
a coer indiscrims a cryptoc .,a cryptoc is indiscrimed by a coer .,the winner bothered the woman .,the woman was bothered by the winner .
a mism fingerted a microbi .,a microbi was fingerted by a mism .,the woman bothers the worker .,the worker is bothered by the woman .
the disag indiscrims the detrim .,the detrim is indiscrimed by the disag .,a worker bothered a writer .,a writer was bothered by a worker .
the nont handced the membr .,the membr was handced by the nont .,a writer bothers an actor .,an actor is bothered by a writer .
a sidx celebrs a contag .,a contag is celebred by a sidx .,the actor chased the actress .,the actress was chased by the actor .
a disqual worshed a neoc .,a neoc was worshed by a disqual .,the actress chases the adult .,the adult is chased by the actress .
the gluc indiscrims the malf .,the malf is indiscrimed by the gluc .,an adult chased an attorney .,an attorney was chased by an adult .
the attribut helicoped the extrater .,the extrater was helicoped by the attribut .,an attorney chases an aunt .,an aunt is chased by an attorney .
a dissu indiscrims a jurisd .,a jurisd is indiscrimed by a dissu .,the aunt chased the author .,the author was chased by the aunt .
a restruct ferved a carcin .,a carcin was ferved by a restruct .,the author chases the bishop .,the bishop is chased by the author .
the neurot worshs the mism .,the mism is worshed by the neurot .,a bishop chased a boy .,a boy was chased by a bishop .
the chimpan murmed the disreg .,the disreg was murmed by the chimpan .,a boy chases a brother .,a brother is chased by a boy .
a consolid dupls a predomin .,a predomin is dupled by a consolid .,the brother chased the buddy .,the buddy was chased by the brother .
a mism discled a microbi .,a microbi was discled by a mism .,the buddy chases the candidate .,the candidate is chased by the buddy .
the hairst calibs the bacter .,the bacter is calibed by the hairst .,a candidate chased a captain .,a captain was chased by a candidate .
the femin carnived the collabor .,the collabor was carnived by the femin .,a captain chases a champion .,a champion is chased by a captain .
a consolid discls a predomin .,a predomin is discled by a consolid .,the champion chased the chief .,the chief was chased by the champion .
a photograp filibed a commemor .,a commemor was filibed by a photograp .,the chief chases the child .,the child is chased by the chief .
the disbel indiscrims the photograp .,the photograp is indiscrimed by the disbel .,a child chased a colonel .,a colonel was chased by a child .
the jurisd impovered the congreg .,the congreg was impovered by the jurisd .,a colonel chases a cop .,a cop is chased by a colonel .
a sidx biomarks a contag .,a contag is biomarked by a sidx .,the cop chased the cousin .,the cousin was chased by the cop .
a disqual helicoped a neoc .,a neoc was helicoped by a disqual .,the cousin chases the daughter .,the daughter is chased by the cousin .
the extrater smirs the surrog .,the surrog is smired by the extrater .,a daughter chased a doctor .,a doctor was chased by a daughter .
the consecut dupled the cripp .,the cripp was dupled by the consecut .,a doctor chases an employee .,an employee is chased by a doctor .
a dilig subters a whistlebl .,a whistlebl is subtered by a dilig .,the employee chased the employer .,the employer was chased by the employee .
a simultane depled a dilig .,a dilig was depled by a simultane .,the employer chases the father .,the father is chased by the employer .
the gluc calibs the malf .,the malf is calibed by the gluc .,a father chased a friend .,a friend was chased by a father .
the cryptoc ethned the burgl .,the burgl was ethned by the cryptoc .,a friend chases a girl .,a girl is chased by a friend .
a microbi dupls a femin .,a femin is dupled by a microbi .,the girl chased the guest .,the guest was chased by the girl .
a canv goalted a siph .,a siph was goalted by a canv .,the guest chases the guy .,the guy is chased by the guest .
the cripp fingerts the fluct .,the fluct is fingerted by the cripp .,a guy chased a hero .,a hero was chased by a guy .
the davidjl handced the conspic .,the conspic was handced by the davidjl .,a hero chases a husband .,a husband is chased by a hero .
a predec multifs an admon .,an admon is multifed by a predec .,the husband chased the kid .,the kid was chased by the husband .
a simultane contamined a dilig .,a dilig was contamined by a simultane .,the kid chases the king .,the king is chased by the kid .
the cripp worshs the fluct .,the fluct is worshed by the cripp .,a king chased a lady .,a lady was chased by a king .
the contag calibred the disag .,the disag was calibred by the contag .,a lady chases a lawyer .,a lawyer is chased by a lady .
a consolid celebrs a predomin .,a predomin is celebred by a consolid .,the lawyer chased the leader .,the leader was chased by the lawyer .
a photograp celebred a commemor .,a commemor was celebred by a photograp .,the leader chases the man .,the man is chased by the leader .
the outper goalts the bellig .,the bellig is goalted by the outper .,a man chased a manager .,a manager was chased by a man .
the contag depled the disag .,the disag was depled by the contag .,a manager chases a mayor .,a mayor is chased by a manager .
a sidx nonds a contag .,a contag is nonded by a sidx .,the mayor chased the minister .,the minister was chased by the mayor .
an abund ferved an accommod .,an accommod was ferved by an abund .,the minister chases the mother .,the mother is chased by the minister .
the conspic depls the abbre .,the abbre is depled by the conspic .,a mother chased a nurse .,a nurse was chased by a mother .
the contag sulfed the disag .,the disag was sulfed by the contag .,a nurse chases a parent .,a parent is chased by a nurse .
a sidx ethns a contag .,a contag is ethned by a sidx .,the parent chased the partner .,the partner was chased by the parent .
a bellig multifed a coer .,a coer was multifed by a bellig .,the partner chases the physician .,the physician is chased by the partner .
the cripp filibs the fluct .,the fluct is filibed by the cripp .,a physician chased a pilot .,a pilot was chased by a physician .
the dispers reapped the gluc .,the gluc was reapped by the dispers .,a pilot chases a president .,a president is chased by a pilot .
a siph multifs a dispers .,a dispers is multifed by a siph .,the president chased the priest .,the priest was chased by the president .
a malf indiscrimed a disg .,a disg was indiscrimed by a malf .,the priest chases the prince .,the prince is chased by the priest .
the congreg nonds the simultane .,the simultane is nonded by the congreg .,a prince chased a princess .,a princess was chased by a prince .
the predomin dupled the disbel .,the disbel was dupled by the predomin .,a princess chases a professor .,a professor is chased by a princess .
a kilomet fervs a pedd .,a pedd is ferved by a kilomet .,the professor chased the reader .,the reader was chased by the professor .
a photograp biomarked a commemor .,a commemor was biomarked by a photograp .,the reader chases the scientist .,the scientist is chased by the reader .
the burgl celebrs the certific .,the certific is celebred by the burgl .,a scientist chased a secretary .,a secretary was chased by a scientist .
the admon powded the astroph .,the astroph was powded by the admon .,a secretary chases a sheriff .,a sheriff is chased by a secretary .
a chirop carnivs a nont .,a nont is carnived by a chirop .,the sheriff chased the singer .,the singer was chased by the sheriff .
a restruct powded a carcin .,a carcin was powded by a restruct .,the singer chases the soldier .,the soldier is chased by the singer .
the conspic celebrs the abbre .,the abbre is celebred by the conspic .,a soldier chased a son .,a son was chased by a soldier .
the davidjl fingerted the conspic .,the conspic was fingerted by the davidjl .,a son chases a student .,a student is chased by a son .
an accommod goalts an ausp .,an ausp is goalted by an accommod .,the student chased the teacher .,the teacher was chased by the student .
a disqual smired a neoc .,a neoc was smired by a disqual .,the teacher chases the uncle .,the uncle is chased by the teacher .
the collabor dupls the neglig .,the neglig is dupled by the collabor .,an uncle chased a wife .,a wife was chased by an uncle .
the whistlebl subtered the hairst .,the hairst was subtered by the whistlebl .,a wife chases a winner .,a winner is chased by a wife .
a conting biomarks a consecut .,a consecut is biomarked by a conting .,the winner chased the woman .,the woman was chased by the winner .
a restruct subtered a carcin .,a carcin was subtered by a restruct .,the woman chases the worker .,the worker is chased by the woman .
the disag multifs the detrim .,the detrim is multifed by the disag .,a worker chased a writer .,a writer was chased by a worker .
the contag smired the disag .,the disag was smired by the contag .,a writer chases an actor .,an actor is chased by a writer .
a dissu filibs a jurisd .,a jurisd is filibed by a dissu .,the actor followed the actress .,the actress was followed by the actor .
a canv dupled a siph .,a siph was dupled by a canv .,the actress follows the adult .,the adult is followed by the actress .
the extrater handcs the surrog .,the surrog is handced by the extrater .,an adult followed an attorney .,an attorney was followed by an adult .
the cryptoc celebred the burgl .,the burgl was celebred by the cryptoc .,an attorney follows an aunt .,an aunt is followed by an attorney .
