pa,pp,ta,tp
a child strikes a colonel .,a colonel is struck by a child .,a priest strikes a prince .,a prince is struck by a priest .
a nurse grabs an opponent .,an opponent is grabbed by a nurse .,a bishop grabs a boy .,a boy is grabbed by a bishop .
a physician protects a pilot .,a pilot is protected by a physician .,a candidate protects a captain .,a captain is protected by a candidate .
a guest describes a guy .,a guy is described by a guest .,a student describes a teacher .,a teacher is described by a student .
an aunt hurts an author .,an author is hurt by an aunt .,a mayor hurts a minister .,a minister is hurt by a mayor .
a doctor follows an employee .,an employee is followed by a doctor .,a scientist follows a secretary .,a secretary is followed by a scientist .
a boy describes a brother .,a brother is described by a boy .,a nurse describes an opponent .,an opponent is described by a nurse .
a lawyer describes a leader .,a leader is described by a lawyer .,a writer describes an actor .,an actor is described by a writer .
a prince strikes a princess .,a princess is struck by a prince .,a child strikes a colonel .,a colonel is struck by a child .
a woman describes a worker .,a worker is described by a woman .,a kid describes a king .,a king is described by a kid .
a pilot raises a president .,a president is raised by a pilot .,a captain raises a champion .,a champion is raised by a captain .
a president surprises a priest .,a priest is surprised by a president .,a champion surprises a chief .,a chief is surprised by a champion .
a captain selects a champion .,a champion is selected by a captain .,a physician selects a pilot .,a pilot is selected by a physician .
a reader kisses a scientist .,a scientist is kissed by a reader .,a cousin kisses a daughter .,a daughter is kissed by a cousin .
a priest hurts a prince .,a prince is hurt by a priest .,a chief hurts a child .,a child is hurt by a chief .
a physician embraces a pilot .,a pilot is embraced by a physician .,a candidate embraces a captain .,a captain is embraced by a candidate .
a princess teaches a professor .,a professor is taught by a princess .,a colonel teaches a cop .,a cop is taught by a colonel .
a nurse surprises an opponent .,an opponent is surprised by a nurse .,a bishop surprises a boy .,a boy is surprised by a bishop .
a leader hurts a man .,a man is hurt by a leader .,an actor hurts an actress .,an actress is hurt by an actor .
a physician beats a pilot .,a pilot is beaten by a physician .,a candidate beats a captain .,a captain is beaten by a candidate .
a lady carries a lawyer .,a lawyer is carried by a lady .,a worker carries a writer .,a writer is carried by a worker .
a partner asks a physician .,a physician is asked by a partner .,a buddy asks a candidate .,a candidate is asked by a buddy .
a nurse strikes an opponent .,an opponent is struck by a nurse .,a bishop strikes a boy .,a boy is struck by a bishop .
a student chases a teacher .,a teacher is chased by a student .,a girl chases a guest .,a guest is chased by a girl .
a candidate punches a captain .,a captain is punched by a candidate .,a partner punches a physician .,a physician is punched by a partner .
a student judges a teacher .,a teacher is judged by a student .,a girl judges a guest .,a guest is judged by a girl .
a pilot washes a president .,a president is washed by a pilot .,a captain washes a champion .,a champion is washed by a captain .
a nurse drags an opponent .,an opponent is dragged by a nurse .,a bishop drags a boy .,a boy is dragged by a bishop .
an aunt kills an author .,an author is killed by an aunt .,a mayor kills a minister .,a minister is killed by a mayor .
a woman kisses a worker .,a worker is kissed by a woman .,a kid kisses a king .,a king is kissed by a kid .
a scientist drags a secretary .,a secretary is dragged by a scientist .,a daughter drags a doctor .,a doctor is dragged by a daughter .
a mayor grabs a minister .,a minister is grabbed by a mayor .,an attorney grabs an aunt .,an aunt is grabbed by an attorney .
a professor grabs a reader .,a reader is grabbed by a professor .,a cop grabs a cousin .,a cousin is grabbed by a cop .
a secretary kills a sheriff .,a sheriff is killed by a secretary .,a doctor kills an employee .,an employee is killed by a doctor .
a man helps a manager .,a manager is helped by a man .,an actress helps an adult .,an adult is helped by an actress .
a manager embraces a mayor .,a mayor is embraced by a manager .,an adult embraces an attorney .,an attorney is embraced by an adult .
a professor forgets a reader .,a reader is forgotten by a professor .,a cop forgets a cousin .,a cousin is forgotten by a cop .
an uncle follows a wife .,a wife is followed by an uncle .,a guy follows a hero .,a hero is followed by a guy .
a singer drags a soldier .,a soldier is dragged by a singer .,an employer drags a father .,a father is dragged by an employer .
a bishop catches a boy .,a boy is caught by a bishop .,a mother catches a nurse .,a nurse is caught by a mother .
a mayor strikes a minister .,a minister is struck by a mayor .,an attorney strikes an aunt .,an aunt is struck by an attorney .
a child hurts a colonel .,a colonel is hurt by a child .,a priest hurts a prince .,a prince is hurt by a priest .
a singer understands a soldier .,a soldier is understood by a singer .,an employer understands a father .,a father is understood by an employer .
a pilot teaches a president .,a president is taught by a pilot .,a captain teaches a champion .,a champion is taught by a captain .
a lady forgives a lawyer .,a lawyer is forgiven by a lady .,a worker forgives a writer .,a writer is forgiven by a worker .
a girl carries a guest .,a guest is carried by a girl .,a son carries a student .,a student is carried by a son .
a bishop kisses a boy .,a boy is kissed by a bishop .,a mother kisses a nurse .,a nurse is kissed by a mother .
a singer embraces a soldier .,a soldier is embraced by a singer .,an employer embraces a father .,a father is embraced by an employer .
an opponent follows a parent .,a parent is followed by an opponent .,a boy follows a brother .,a brother is followed by a boy .
a lawyer embraces a leader .,a leader is embraced by a lawyer .,a writer embraces an actor .,an actor is embraced by a writer .
a colonel joins a cop .,a cop is joined by a colonel .,a prince joins a princess .,a princess is joined by a prince .
a singer raises a soldier .,a soldier is raised by a singer .,an employer raises a father .,a father is raised by an employer .
a friend judges a girl .,a girl is judged by a friend .,a soldier judges a son .,a son is judged by a soldier .
a candidate teaches a captain .,a captain is taught by a candidate .,a partner teaches a physician .,a physician is taught by a partner .
an uncle selects a wife .,a wife is selected by an uncle .,a guy selects a hero .,a hero is selected by a guy .
an employer kills a father .,a father is killed by an employer .,a sheriff kills a singer .,a singer is killed by a sheriff .
an author catches a bishop .,a bishop is caught by an author .,a minister catches a mother .,a mother is caught by a minister .
a doctor judges an employee .,an employee is judged by a doctor .,a scientist judges a secretary .,a secretary is judged by a scientist .
an actress bothers an adult .,an adult is bothered by an actress .,a leader bothers a man .,a man is bothered by a leader .
a captain catches a champion .,a champion is caught by a captain .,a physician catches a pilot .,a pilot is caught by a physician .
a secretary forgets a sheriff .,a sheriff is forgotten by a secretary .,a doctor forgets an employee .,an employee is forgotten by a doctor .
a teacher surprises an uncle .,an uncle is surprised by a teacher .,a guest surprises a guy .,a guy is surprised by a guest .
a minister kisses a mother .,a mother is kissed by a minister .,an aunt kisses an author .,an author is kissed by an aunt .
an author asks a bishop .,a bishop is asked by an author .,a minister asks a mother .,a mother is asked by a minister .
a wife forgives a winner .,a winner is forgiven by a wife .,a hero forgives a husband .,a husband is forgiven by a hero .
a friend chases a girl .,a girl is chased by a friend .,a soldier chases a son .,a son is chased by a soldier .
a king hurts a lady .,a lady is hurt by a king .,a woman hurts a worker .,a worker is hurt by a woman .
a mayor judges a minister .,a minister is judged by a mayor .,an attorney judges an aunt .,an aunt is judged by an attorney .
a winner forgives a woman .,a woman is forgiven by a winner .,a husband forgives a kid .,a kid is forgiven by a husband .
a mayor chases a minister .,a minister is chased by a mayor .,an attorney chases an aunt .,an aunt is chased by an attorney .
a teacher kills an uncle .,an uncle is killed by a teacher .,a guest kills a guy .,a guy is killed by a guest .
a child teaches a colonel .,a colonel is taught by a child .,a priest teaches a prince .,a prince is taught by a priest .
a manager joins a mayor .,a mayor is joined by a manager .,an adult joins an attorney .,an attorney is joined by an adult .
a brother follows a buddy .,a buddy is followed by a brother .,an opponent follows a parent .,a parent is followed by an opponent .
a teacher bothers an uncle .,an uncle is bothered by a teacher .,a guest bothers a guy .,a guy is bothered by a guest .
a leader hurries a man .,a man is hurried by a leader .,an actor hurries an actress .,an actress is hurried by an actor .
a leader drags a man .,a man is dragged by a leader .,an actor drags an actress .,an actress is dragged by an actor .
a friend catches a girl .,a girl is caught by a friend .,a soldier catches a son .,a son is caught by a soldier .
a colonel embraces a cop .,a cop is embraced by a colonel .,a prince embraces a princess .,a princess is embraced by a prince .
a champion forgets a chief .,a chief is forgotten by a champion .,a pilot forgets a president .,a president is forgotten by a pilot .
a leader comforts a man .,a man is comforted by a leader .,an actor comforts an actress .,an actress is comforted by an actor .
a partner kisses a physician .,a physician is kissed by a partner .,a buddy kisses a candidate .,a candidate is kissed by a buddy .
a boy judges a brother .,a brother is judged by a boy .,a nurse judges an opponent .,an opponent is judged by a nurse .
a boy drags a brother .,a brother is dragged by a boy .,a nurse drags an opponent .,an opponent is dragged by a nurse .
a prince follows a princess .,a princess is followed by a prince .,a child follows a colonel .,a colonel is followed by a child .
a president hurries a priest .,a priest is hurried by a president .,a champion hurries a chief .,a chief is hurried by a champion .
a pilot chases a president .,a president is chased by a pilot .,a captain chases a champion .,a champion is chased by a captain .
a cousin helps a daughter .,a daughter is helped by a cousin .,a professor helps a reader .,a reader is helped by a professor .
a cop kills a cousin .,a cousin is killed by a cop .,a princess kills a professor .,a professor is killed by a princess .
a reader forgives a scientist .,a scientist is forgiven by a reader .,a cousin forgives a daughter .,a daughter is forgiven by a cousin .
a pilot bothers a president .,a president is bothered by a pilot .,a captain bothers a champion .,a champion is bothered by a captain .
an employer chases a father .,a father is chased by an employer .,a sheriff chases a singer .,a singer is chased by a sheriff .
a lawyer grabs a leader .,a leader is grabbed by a lawyer .,a writer grabs an actor .,an actor is grabbed by a writer .
an opponent discovers a parent .,a parent is discovered by an opponent .,a boy discovers a brother .,a brother is discovered by a boy .
an attorney chases an aunt .,an aunt is chased by an attorney .,a manager chases a mayor .,a mayor is chased by a manager .
a mother follows a nurse .,a nurse is followed by a mother .,an author follows a bishop .,a bishop is followed by an author .
an attorney grabs an aunt .,an aunt is grabbed by an attorney .,a manager grabs a mayor .,a mayor is grabbed by a manager .
a woman judges a worker .,a worker is judged by a woman .,a kid judges a king .,a king is judged by a kid .
an opponent bothers a parent .,a parent is bothered by an opponent .,a boy bothers a brother .,a brother is bothered by a boy .
a secretary hurts a sheriff .,a sheriff is hurt by a secretary .,a doctor hurts an employee .,an employee is hurt by a doctor .
a mayor comforts a minister .,a minister is comforted by a mayor .,an attorney comforts an aunt .,an aunt is comforted by an attorney .
a prince understands a princess .,a princess is understood by a prince .,a child understands a colonel .,a colonel is understood by a child .
an author grabs a bishop .,a bishop is grabbed by an author .,a minister grabs a mother .,a mother is grabbed by a minister .
a scientist forgets a secretary .,a secretary is forgotten by a scientist .,a daughter forgets a doctor .,a doctor is forgotten by a daughter .
a woman carries a worker .,a worker is carried by a woman .,a kid carries a king .,a king is carried by a kid .
a woman washes a worker .,a worker is washed by a woman .,a kid washes a king .,a king is washed by a kid .
a worker hurries a writer .,a writer is hurried by a worker .,a king hurries a lady .,a lady is hurried by a king .
a buddy understands a candidate .,a candidate is understood by a buddy .,a parent understands a partner .,a partner is understood by a parent .
a manager beats a mayor .,a mayor is beaten by a manager .,an adult beats an attorney .,an attorney is beaten by an adult .
a chief catches a child .,a child is caught by a chief .,a president catches a priest .,a priest is caught by a president .
an actress washes an adult .,an adult is washed by an actress .,a leader washes a man .,a man is washed by a leader .
a priest bothers a prince .,a prince is bothered by a priest .,a chief bothers a child .,a child is bothered by a chief .
an author understands a bishop .,a bishop is understood by an author .,a minister understands a mother .,a mother is understood by a minister .
a parent carries a partner .,a partner is carried by a parent .,a brother carries a buddy .,a buddy is carried by a brother .
a writer follows an actor .,an actor is followed by a writer .,a lady follows a lawyer .,a lawyer is followed by a lady .
a buddy comforts a candidate .,a candidate is comforted by a buddy .,a parent comforts a partner .,a partner is comforted by a parent .
a husband asks a kid .,a kid is asked by a husband .,a wife asks a winner .,a winner is asked by a wife .
an aunt kisses an author .,an author is kissed by an aunt .,a mayor kisses a minister .,a minister is kissed by a mayor .
a brother strikes a buddy .,a buddy is struck by a brother .,an opponent strikes a parent .,a parent is struck by an opponent .
a girl destroys a guest .,a guest is destroyed by a girl .,a son destroys a student .,a student is destroyed by a son .
a candidate judges a captain .,a captain is judged by a candidate .,a partner judges a physician .,a physician is judged by a partner .
an employer catches a father .,a father is caught by an employer .,a sheriff catches a singer .,a singer is caught by a sheriff .
a boy joins a brother .,a brother is joined by a boy .,a nurse joins an opponent .,an opponent is joined by a nurse .
a candidate follows a captain .,a captain is followed by a candidate .,a partner follows a physician .,a physician is followed by a partner .
an uncle carries a wife .,a wife is carried by an uncle .,a guy carries a hero .,a hero is carried by a guy .
a man raises a manager .,a manager is raised by a man .,an actress raises an adult .,an adult is raised by an actress .
a manager kills a mayor .,a mayor is killed by a manager .,an adult kills an attorney .,an attorney is killed by an adult .
a cop grabs a cousin .,a cousin is grabbed by a cop .,a princess grabs a professor .,a professor is grabbed by a princess .
a sheriff joins a singer .,a singer is joined by a sheriff .,an employee joins an employer .,an employer is joined by an employee .
a kid helps a king .,a king is helped by a kid .,a winner helps a woman .,a woman is helped by a winner .
a manager understands a mayor .,a mayor is understood by a manager .,an adult understands an attorney .,an attorney is understood by an adult .
a student raises a teacher .,a teacher is raised by a student .,a girl raises a guest .,a guest is raised by a girl .
a professor follows a reader .,a reader is followed by a professor .,a cop follows a cousin .,a cousin is followed by a cop .
a daughter teaches a doctor .,a doctor is taught by a daughter .,a reader teaches a scientist .,a scientist is taught by a reader .
an aunt joins an author .,an author is joined by an aunt .,a mayor joins a minister .,a minister is joined by a mayor .
a boy understands a brother .,a brother is understood by a boy .,a nurse understands an opponent .,an opponent is understood by a nurse .
a cousin judges a daughter .,a daughter is judged by a cousin .,a professor judges a reader .,a reader is judged by a professor .
an opponent kills a parent .,a parent is killed by an opponent .,a boy kills a brother .,a brother is killed by a boy .
an aunt washes an author .,an author is washed by an aunt .,a mayor washes a minister .,a minister is washed by a mayor .
a man carries a manager .,a manager is carried by a man .,an actress carries an adult .,an adult is carried by an actress .
a brother surprises a buddy .,a buddy is surprised by a brother .,an opponent surprises a parent .,a parent is surprised by an opponent .
an actor strikes an actress .,an actress is struck by an actor .,a lawyer strikes a leader .,a leader is struck by a lawyer .
a pilot comforts a president .,a president is comforted by a pilot .,a captain comforts a champion .,a champion is comforted by a captain .
a scientist protects a secretary .,a secretary is protected by a scientist .,a daughter protects a doctor .,a doctor is protected by a daughter .
a guy drags a hero .,a hero is dragged by a guy .,a teacher drags an uncle .,an uncle is dragged by a teacher .
a king understands a lady .,a lady is understood by a king .,a woman understands a worker .,a worker is understood by a woman .
a doctor embraces an employee .,an employee is embraced by a doctor .,a scientist embraces a secretary .,a secretary is embraced by a scientist .
a singer kills a soldier .,a soldier is killed by a singer .,an employer kills a father .,a father is killed by an employer .
a man beats a manager .,a manager is beaten by a man .,an actress beats an adult .,an adult is beaten by an actress .
a husband beats a kid .,a kid is beaten by a husband .,a wife beats a winner .,a winner is beaten by a wife .
a partner catches a physician .,a physician is caught by a partner .,a buddy catches a candidate .,a candidate is caught by a buddy .
a physician judges a pilot .,a pilot is judged by a physician .,a candidate judges a captain .,a captain is judged by a candidate .
a child comforts a colonel .,a colonel is comforted by a child .,a priest comforts a prince .,a prince is comforted by a priest .
a worker joins a writer .,a writer is joined by a worker .,a king joins a lady .,a lady is joined by a king .
a cousin catches a daughter .,a daughter is caught by a cousin .,a professor catches a reader .,a reader is caught by a professor .
a wife chases a winner .,a winner is chased by a wife .,a hero chases a husband .,a husband is chased by a hero .
a manager asks a mayor .,a mayor is asked by a manager .,an adult asks an attorney .,an attorney is asked by an adult .
a boy forgets a brother .,a brother is forgotten by a boy .,a nurse forgets an opponent .,an opponent is forgotten by a nurse .
a king grabs a lady .,a lady is grabbed by a king .,a woman grabs a worker .,a worker is grabbed by a woman .
an actor grabs an actress .,an actress is grabbed by an actor .,a lawyer grabs a leader .,a leader is grabbed by a lawyer .
a minister judges a mother .,a mother is judged by a minister .,an aunt judges an author .,an author is judged by an aunt .
a lawyer selects a leader .,a leader is selected by a lawyer .,a writer selects an actor .,an actor is selected by a writer .
a parent kills a partner .,a partner is killed by a parent .,a brother kills a buddy .,a buddy is killed by a brother .
a wife hurries a winner .,a winner is hurried by a wife .,a hero hurries a husband .,a husband is hurried by a hero .
a nurse judges an opponent .,an opponent is judged by a nurse .,a bishop judges a boy .,a boy is judged by a bishop .
a kid strikes a king .,a king is struck by a kid .,a winner strikes a woman .,a woman is struck by a winner .
an actress joins an adult .,an adult is joined by an actress .,a leader joins a man .,a man is joined by a leader .
a daughter raises a doctor .,a doctor is raised by a daughter .,a reader raises a scientist .,a scientist is raised by a reader .
an employee asks an employer .,an employer is asked by an employee .,a secretary asks a sheriff .,a sheriff is asked by a secretary .
an employer protects a father .,a father is protected by an employer .,a sheriff protects a singer .,a singer is protected by a sheriff .
a president carries a priest .,a priest is carried by a president .,a champion carries a chief .,a chief is carried by a champion .
a secretary carries a sheriff .,a sheriff is carried by a secretary .,a doctor carries an employee .,an employee is carried by a doctor .
a prince describes a princess .,a princess is described by a prince .,a child describes a colonel .,a colonel is described by a child .
a buddy carries a candidate .,a candidate is carried by a buddy .,a parent carries a partner .,a partner is carried by a parent .
a captain destroys a champion .,a champion is destroyed by a captain .,a physician destroys a pilot .,a pilot is destroyed by a physician .
a pilot joins a president .,a president is joined by a pilot .,a captain joins a champion .,a champion is joined by a captain .
a friend grabs a girl .,a girl is grabbed by a friend .,a soldier grabs a son .,a son is grabbed by a soldier .
a minister kills a mother .,a mother is killed by a minister .,an aunt kills an author .,an author is killed by an aunt .
a colonel describes a cop .,a cop is described by a colonel .,a prince describes a princess .,a princess is described by a prince .
a nurse embraces an opponent .,an opponent is embraced by a nurse .,a bishop embraces a boy .,a boy is embraced by a bishop .
a teacher asks an uncle .,an uncle is asked by a teacher .,a guest asks a guy .,a guy is asked by a guest .
a colonel comforts a cop .,a cop is comforted by a colonel .,a prince comforts a princess .,a princess is comforted by a prince .
a soldier beats a son .,a son is beaten by a soldier .,a father beats a friend .,a friend is beaten by a father .
a woman selects a worker .,a worker is selected by a woman .,a kid selects a king .,a king is selected by a kid .
an employer embraces a father .,a father is embraced by an employer .,a sheriff embraces a singer .,a singer is embraced by a sheriff .
a husband teaches a kid .,a kid is taught by a husband .,a wife teaches a winner .,a winner is taught by a wife .
a chief forgets a child .,a child is forgotten by a chief .,a president forgets a priest .,a priest is forgotten by a president .
a guy kills a hero .,a hero is killed by a guy .,a teacher kills an uncle .,an uncle is killed by a teacher .
a prince chases a princess .,a princess is chased by a prince .,a child chases a colonel .,a colonel is chased by a child .
a prince judges a princess .,a princess is judged by a prince .,a child judges a colonel .,a colonel is judged by a child .
a candidate describes a captain .,a captain is described by a candidate .,a partner describes a physician .,a physician is described by a partner .
a kid carries a king .,a king is carried by a kid .,a winner carries a woman .,a woman is carried by a winner .
a physician washes a pilot .,a pilot is washed by a physician .,a candidate washes a captain .,a captain is washed by a candidate .
a doctor comforts an employee .,an employee is comforted by a doctor .,a scientist comforts a secretary .,a secretary is comforted by a scientist .
a king beats a lady .,a lady is beaten by a king .,a woman beats a worker .,a worker is beaten by a woman .
a colonel grabs a cop .,a cop is grabbed by a colonel .,a prince grabs a princess .,a princess is grabbed by a prince .
a guy comforts a hero .,a hero is comforted by a guy .,a teacher comforts an uncle .,an uncle is comforted by a teacher .
a leader carries a man .,a man is carried by a leader .,an actor carries an actress .,an actress is carried by an actor .
a husband raises a kid .,a kid is raised by a husband .,a wife raises a winner .,a winner is raised by a wife .
a king embraces a lady .,a lady is embraced by a king .,a woman embraces a worker .,a worker is embraced by a woman .
a priest drags a prince .,a prince is dragged by a priest .,a chief drags a child .,a child is dragged by a chief .
a sheriff strikes a singer .,a singer is struck by a sheriff .,an employee strikes an employer .,an employer is struck by an employee .
a lady forgets a lawyer .,a lawyer is forgotten by a lady .,a worker forgets a writer .,a writer is forgotten by a worker .
a reader surprises a scientist .,a scientist is surprised by a reader .,a cousin surprises a daughter .,a daughter is surprised by a cousin .
a partner drags a physician .,a physician is dragged by a partner .,a buddy drags a candidate .,a candidate is dragged by a buddy .
