pa,pp,ta,tp
the neurot murms the mism .,the mism is murmed by the neurot .,a bishop grabbed a boy .,a boy was grabbed by a bishop .
the nont contamined the membr .,the membr was contamined by the nont .,a boy grabs a brother .,a brother is grabbed by a boy .
an accommod depls an ausp .,an ausp is depled by an accommod .,the brother grabbed the buddy .,the buddy was grabbed by the brother .
a certific celebred a conting .,a conting was celebred by a certific .,the buddy grabs the candidate .,the candidate is grabbed by the buddy .
the burgl carnivs the certific .,the certific is carnived by the burgl .,a candidate grabbed a captain .,a captain was grabbed by a candidate .
the consecut powded the cripp .,the cripp was powded by the consecut .,a captain grabs a champion .,a champion is grabbed by a captain .
a consolid calibs a predomin .,a predomin is calibed by a consolid .,the champion grabbed the chief .,the chief was grabbed by the champion .
a malf celebred a disg .,a disg was celebred by a malf .,the chief grabs the child .,the child is grabbed by the chief .
the conspic sulfs the abbre .,the abbre is sulfed by the conspic .,a child grabbed a colonel .,a colonel was grabbed by a child .
the dispers contraded the gluc .,the gluc was contraded by the dispers .,a colonel grabs a cop .,a cop is grabbed by a colonel .
a conting murms a consecut .,a consecut is murmed by a conting .,the cop grabbed the cousin .,the cousin was grabbed by the cop .
an abund contamined an accommod .,an accommod was contamined by an abund .,the cousin grabs the daughter .,the daughter is grabbed by the cousin .
the astroph clusts the abund .,the abund is clusted by the astroph .,a daughter grabbed a doctor .,a doctor was grabbed by a daughter .
the attribut filibed the extrater .,the extrater was filibed by the attribut .,a doctor grabs an employee .,an employee is grabbed by a doctor .
a dissu reapps a jurisd .,a jurisd is reapped by a dissu .,the employee grabbed the employer .,the employer was grabbed by the employee .
a surrog multifed a chirop .,a chirop was multifed by a surrog .,the employer grabs the father .,the father is grabbed by the employer .
the gluc fervs the malf .,the malf is ferved by the gluc .,a father grabbed a friend .,a friend was grabbed by a father .
the davidjl murmed the conspic .,the conspic was murmed by the davidjl .,a friend grabs a girl .,a girl is grabbed by a friend .
a predec murms an admon .,an admon is murmed by a predec .,the girl grabbed the guest .,the guest was grabbed by the girl .
a malf depled a disg .,a disg was depled by a malf .,the guest grabs the guy .,the guy is grabbed by the guest .
the outper hambs the bellig .,the bellig is hambed by the outper .,a guy grabbed a hero .,a hero was grabbed by a guy .
the nont goalted the membr .,the membr was goalted by the nont .,a hero grabs a husband .,a husband is grabbed by a hero .
a kilomet subters a pedd .,a pedd is subtered by a kilomet .,the husband grabbed the kid .,the kid was grabbed by the husband .
a disqual nonded a neoc .,a neoc was nonded by a disqual .,the kid grabs the king .,the king is grabbed by the kid .
the cripp contamins the fluct .,the fluct is contamined by the cripp .,a king grabbed a lady .,a lady was grabbed by a king .
the cryptoc calibed the burgl .,the burgl was calibed by the cryptoc .,a lady grabs a lawyer .,a lawyer is grabbed by a lady .
a siph murms a dispers .,a dispers is murmed by a siph .,the lawyer grabbed the leader .,the leader was grabbed by the lawyer .
a malf helicoped a disg .,a disg was helicoped by a malf .,the leader grabs the man .,the man is grabbed by the leader .
the outper worshs the bellig .,the bellig is worshed by the outper .,a man grabbed a manager .,a manager was grabbed by a man .
the davidjl smired the conspic .,the conspic was smired by the davidjl .,a manager grabs a mayor .,a mayor is grabbed by a manager .
a neoc nonds a davidjl .,a davidjl is nonded by a neoc .,the mayor grabbed the minister .,the minister was grabbed by the mayor .
a neglig celebred a dissu .,a dissu was celebred by a neglig .,the minister grabs the mother .,the mother is grabbed by the minister .
the neurot powds the mism .,the mism is powded by the neurot .,a mother grabbed a nurse .,a nurse was grabbed by a mother .
the attribut worshed the extrater .,the extrater was worshed by the attribut .,a nurse grabs a parent .,a parent is grabbed by a nurse .
an accommod murms an ausp .,an ausp is murmed by an accommod .,the parent grabbed the partner .,the partner was grabbed by the parent .
a detrim goalted a predec .,a predec was goalted by a detrim .,the partner grabs the physician .,the physician is grabbed by the partner .
the burgl biomarks the certific .,the certific is biomarked by the burgl .,a physician grabbed a pilot .,a pilot was grabbed by a physician .
the contag calibed the disag .,the disag was calibed by the contag .,a pilot grabs a president .,a president is grabbed by a pilot .
a consolid carnivs a predomin .,a predomin is carnived by a consolid .,the president grabbed the priest .,the priest was grabbed by the president .
an abbre calibred a sidx .,a sidx was calibred by an abbre .,the priest grabs the prince .,the prince is grabbed by the priest .
the disag clusts the detrim .,the detrim is clusted by the disag .,a prince grabbed a princess .,a princess was grabbed by a prince .
the confid powded the neurot .,the neurot was powded by the confid .,a princess grabs a professor .,a professor is grabbed by a princess .
a microbi discls a femin .,a femin is discled by a microbi .,the professor grabbed the reader .,the reader was grabbed by the professor .
a certific ferved a conting .,a conting was ferved by a certific .,the reader grabs the scientist .,the scientist is grabbed by the reader .
the outper clusts the bellig .,the bellig is clusted by the outper .,a scientist grabbed a secretary .,a secretary was grabbed by a scientist .
the consecut worshed the cripp .,the cripp was worshed by the consecut .,a secretary grabs a sheriff .,a sheriff is grabbed by a secretary .
a coer helicops a cryptoc .,a cryptoc is helicoped by a coer .,the sheriff grabbed the singer .,the singer was grabbed by the sheriff .
a canv worshed a siph .,a siph was worshed by a canv .,the singer grabs the soldier .,the soldier is grabbed by the singer .
the cripp discls the fluct .,the fluct is discled by the cripp .,a soldier grabbed a son .,a son was grabbed by a soldier .
the consecut contraded the cripp .,the cripp was contraded by the consecut .,a son grabs a student .,a student is grabbed by a son .
a kilomet sulfs a pedd .,a pedd is sulfed by a kilomet .,the student grabbed the teacher .,the teacher was grabbed by the student .
a bacter depled a consolid .,a consolid was depled by a bacter .,the teacher grabs the uncle .,the uncle is grabbed by the teacher .
the barric calibrs the restruct .,the restruct is calibred by the barric .,an uncle grabbed a wife .,a wife was grabbed by an uncle .
the predomin fingerted the disbel .,the disbel was fingerted by the predomin .,a wife grabs a winner .,a winner is grabbed by a wife .
a neoc calibs a davidjl .,a davidjl is calibed by a neoc .,the winner grabbed the woman .,the woman was grabbed by the winner .
an abund celebred an accommod .,an accommod was celebred by an abund .,the woman grabs the worker .,the worker is grabbed by the woman .
the barric biomarks the restruct .,the restruct is biomarked by the barric .,a worker grabbed a writer .,a writer was grabbed by a worker .
the predomin goalted the disbel .,the disbel was goalted by the predomin .,a writer grabs an actor .,an actor is grabbed by a writer .
a predec carnivs an admon .,an admon is carnived by a predec .,the actor raised the actress .,the actress was raised by the actor .
a certific contraded a conting .,a conting was contraded by a certific .,the actress raises the adult .,the adult is raised by the actress .
the barric carnivs the restruct .,the restruct is carnived by the barric .,an adult raised an attorney .,an attorney was raised by an adult .
the consecut impovered the cripp .,the cripp was impovered by the consecut .,an attorney raises an aunt .,an aunt is raised by an attorney .
a sidx goalts a contag .,a contag is goalted by a sidx .,the aunt raised the author .,the author was raised by the aunt .
an abbre worshed a sidx .,a sidx was worshed by an abbre .,the author raises the bishop .,the bishop is raised by the author .
the gluc fingerts the malf .,the malf is fingerted by the gluc .,a bishop raised a boy .,a boy was raised by a bishop .
the consecut goalted the cripp .,the cripp was goalted by the consecut .,a boy raises a brother .,a brother is raised by a boy .
a consolid filibs a predomin .,a predomin is filibed by a consolid .,the brother raised the buddy .,the buddy was raised by the brother .
a malf veterined a disg .,a disg was veterined by a malf .,the buddy raises the candidate .,the candidate is raised by the buddy .
the gluc ethns the malf .,the malf is ethned by the gluc .,a candidate raised a captain .,a captain was raised by a candidate .
the nont carnived the membr .,the membr was carnived by the nont .,a captain raises a champion .,a champion is raised by a captain .
a conting clusts a consecut .,a consecut is clusted by a conting .,the champion raised the chief .,the chief was raised by the champion .
an abund calibred an accommod .,an accommod was calibred by an abund .,the chief raises the child .,the child is raised by the chief .
the congreg handcs the simultane .,the simultane is handced by the congreg .,a child raised a colonel .,a colonel was raised by a child .
the jurisd mosquited the congreg .,the congreg was mosquited by the jurisd .,a colonel raises a cop .,a cop is raised by a colonel .
a disg murms a confid .,a confid is murmed by a disg .,the cop raised the cousin .,the cousin was raised by the cop .
a surrog handced a chirop .,a chirop was handced by a surrog .,the cousin raises the daughter .,the daughter is raised by the cousin .
the collabor murms the neglig .,the neglig is murmed by the collabor .,a daughter raised a doctor .,a doctor was raised by a daughter .
the predomin helicoped the disbel .,the disbel was helicoped by the predomin .,a doctor raises an employee .,an employee is raised by a doctor .
a predec calibrs an admon .,an admon is calibred by a predec .,the employee raised the employer .,the employer was raised by the employee .
an abund mosquited an accommod .,an accommod was mosquited by an abund .,the employer raises the father .,the father is raised by the employer .
the neurot filibs the mism .,the mism is filibed by the neurot .,a father raised a friend .,a friend was raised by a father .
the consecut murmed the cripp .,the cripp was murmed by the consecut .,a friend raises a girl .,a girl is raised by a friend .
a carcin calibs an attribut .,an attribut is calibed by a carcin .,the girl raised the guest .,the guest was raised by the girl .
a detrim helicoped a predec .,a predec was helicoped by a detrim .,the guest raises the guy .,the guy is raised by the guest .
the collabor contrads the neglig .,the neglig is contraded by the collabor .,a guy raised a hero .,a hero was raised by a guy .
the admon contamined the astroph .,the astroph was contamined by the admon .,a hero raises a husband .,a husband is raised by a hero .
a sidx mosquits a contag .,a contag is mosquited by a sidx .,the husband raised the kid .,the kid was raised by the husband .
a detrim veterined a predec .,a predec was veterined by a detrim .,the kid raises the king .,the king is raised by the kid .
the hairst handcs the bacter .,the bacter is handced by the hairst .,a king raised a lady .,a lady was raised by a king .
the consecut veterined the cripp .,the cripp was veterined by the consecut .,a lady raises a lawyer .,a lawyer is raised by a lady .
a microbi helicops a femin .,a femin is helicoped by a microbi .,the lawyer raised the leader .,the leader was raised by the lawyer .
a bacter carnived a consolid .,a consolid was carnived by a bacter .,the leader raises the man .,the man is raised by the leader .
the membr powds the canv .,the canv is powded by the membr .,a man raised a manager .,a manager was raised by a man .
the chimpan hambed the disreg .,the disreg was hambed by the chimpan .,a manager raises a mayor .,a mayor is raised by a manager .
a predec smirs an admon .,an admon is smired by a predec .,the mayor raised the minister .,the minister was raised by the mayor .
a canv biomarked a siph .,a siph was biomarked by a canv .,the minister raises the mother .,the mother is raised by the minister .
the outper nonds the bellig .,the bellig is nonded by the outper .,a mother raised a nurse .,a nurse was raised by a mother .
the pedd smired the barric .,the barric was smired by the pedd .,a nurse raises a parent .,a parent is raised by a nurse .
a kilomet smirs a pedd .,a pedd is smired by a kilomet .,the parent raised the partner .,the partner was raised by the parent .
a canv ferved a siph .,a siph was ferved by a canv .,the partner raises the physician .,the physician is raised by the partner .
the disbel discls the photograp .,the photograp is discled by the disbel .,a physician raised a pilot .,a pilot was raised by a physician .
the predomin discled the disbel .,the disbel was discled by the predomin .,a pilot raises a president .,a president is raised by a pilot .
a commemor powds a chimpan .,a chimpan is powded by a commemor .,the president raised the priest .,the priest was raised by the president .
a surrog sulfed a chirop .,a chirop was sulfed by a surrog .,the priest raises the prince .,the prince is raised by the priest .
the disreg carnivs the disqual .,the disqual is carnived by the disreg .,a prince raised a princess .,a princess was raised by a prince .
the ausp discled the outper .,the outper was discled by the ausp .,a princess raises a professor .,a professor is raised by a princess .
a siph discls a dispers .,a dispers is discled by a siph .,the professor raised the reader .,the reader was raised by the professor .
a bacter powded a consolid .,a consolid was powded by a bacter .,the reader raises the scientist .,the scientist is raised by the reader .
the neurot discls the mism .,the mism is discled by the neurot .,a scientist raised a secretary .,a secretary was raised by a scientist .
the consecut discled the cripp .,the cripp was discled by the consecut .,a secretary raises a sheriff .,a sheriff is raised by a secretary .
a predec impovers an admon .,an admon is impovered by a predec .,the sheriff raised the singer .,the singer was raised by the sheriff .
a neglig multifed a dissu .,a dissu was multifed by a neglig .,the singer raises the soldier .,the soldier is raised by the singer .
the disreg sulfs the disqual .,the disqual is sulfed by the disreg .,a soldier raised a son .,a son was raised by a soldier .
the jurisd fingerted the congreg .,the congreg was fingerted by the jurisd .,a son raises a student .,a student is raised by a son .
a conting worshs a consecut .,a consecut is worshed by a conting .,the student raised the teacher .,the teacher was raised by the student .
a bacter goalted a consolid .,a consolid was goalted by a bacter .,the teacher raises the uncle .,the uncle is raised by the teacher .
the neurot calibs the mism .,the mism is calibed by the neurot .,an uncle raised a wife .,a wife was raised by an uncle .
the whistlebl carnived the hairst .,the hairst was carnived by the whistlebl .,a wife raises a winner .,a winner is raised by a wife .
a coer goalts a cryptoc .,a cryptoc is goalted by a coer .,the winner raised the woman .,the woman was raised by the winner .
an abbre veterined a sidx .,a sidx was veterined by an abbre .,the woman raises the worker .,the worker is raised by the woman .
the collabor celebrs the neglig .,the neglig is celebred by the collabor .,a worker raised a writer .,a writer was raised by a worker .
the contag reapped the disag .,the disag was reapped by the contag .,a writer raises an actor .,an actor is raised by a writer .
a conting filibs a consecut .,a consecut is filibed by a conting .,the actor selected the actress .,the actress was selected by the actor .
a canv fingerted a siph .,a siph was fingerted by a canv .,the actress selects the adult .,the adult is selected by the actress .
the outper contamins the bellig .,the bellig is contamined by the outper .,an adult selected an attorney .,an attorney was selected by an adult .
the confid biomarked the neurot .,the neurot was biomarked by the confid .,an attorney selects an aunt .,an aunt is selected by an attorney .
a consolid helicops a predomin .,a predomin is helicoped by a consolid .,the aunt selected the author .,the author was selected by the aunt .
a fluct reapped a kilomet .,a kilomet was reapped by a fluct .,the author selects the bishop .,the bishop is selected by the author .
the disreg veterins the disqual .,the disqual is veterined by the disreg .,a bishop selected a boy .,a boy was selected by a bishop .
the pedd fingerted the barric .,the barric was fingerted by the pedd .,a boy selects a brother .,a brother is selected by a boy .
a dilig calibrs a whistlebl .,a whistlebl is calibred by a dilig .,the brother selected the buddy .,the buddy was selected by the brother .
a bacter ferved a consolid .,a consolid was ferved by a bacter .,the buddy selects the candidate .,the candidate is selected by the buddy .
the congreg discls the simultane .,the simultane is discled by the congreg .,a candidate selected a captain .,a captain was selected by a candidate .
the contag ethned the disag .,the disag was ethned by the contag .,a captain selects a champion .,a champion is selected by a captain .
a conting ethns a consecut .,a consecut is ethned by a conting .,the champion selected the chief .,the chief was selected by the champion .
a bellig powded a coer .,a coer was powded by a bellig .,the chief selects the child .,the child is selected by the chief .
the hairst carnivs the bacter .,the bacter is carnived by the hairst .,a child selected a colonel .,a colonel was selected by a child .
the nont mosquited the membr .,the membr was mosquited by the nont .,a colonel selects a cop .,a cop is selected by a colonel .
a sidx discls a contag .,a contag is discled by a sidx .,the cop selected the cousin .,the cousin was selected by the cop .
a photograp calibred a commemor .,a commemor was calibred by a photograp .,the cousin selects the daughter .,the daughter is selected by the cousin .
the conspic smirs the abbre .,the abbre is smired by the conspic .,a daughter selected a doctor .,a doctor was selected by a daughter .
the chimpan reapped the disreg .,the disreg was reapped by the chimpan .,a doctor selects an employee .,an employee is selected by a doctor .
a coer calibs a cryptoc .,a cryptoc is calibed by a coer .,the employee selected the employer .,the employer was selected by the employee .
a canv depled a siph .,a siph was depled by a canv .,the employer selects the father .,the father is selected by the employer .
the burgl fervs the certific .,the certific is ferved by the burgl .,a father selected a friend .,a friend was selected by a father .
the davidjl dupled the conspic .,the conspic was dupled by the davidjl .,a friend selects a girl .,a girl is selected by a friend .
a consolid sulfs a predomin .,a predomin is sulfed by a consolid .,the girl selected the guest .,the guest was selected by the girl .
a disqual calibed a neoc .,a neoc was calibed by a disqual .,the guest selects the guy .,the guy is selected by the guest .
the congreg ethns the simultane .,the simultane is ethned by the congreg .,a guy selected a hero .,a hero was selected by a guy .
the cryptoc clusted the burgl .,the burgl was clusted by the cryptoc .,a hero selects a husband .,a husband is selected by a hero .
a kilomet reapps a pedd .,a pedd is reapped by a kilomet .,the husband selected the kid .,the kid was selected by the husband .
a mism ferved a microbi .,a microbi was ferved by a mism .,the kid selects the king .,the king is selected by the kid .
the hairst multifs the bacter .,the bacter is multifed by the hairst .,a king selected a lady .,a lady was selected by a king .
the chimpan indiscrimed the disreg .,the disreg was indiscrimed by the chimpan .,a lady selects a lawyer .,a lawyer is selected by a lady .
a microbi filibs a femin .,a femin is filibed by a microbi .,the lawyer selected the leader .,the leader was selected by the lawyer .
a surrog helicoped a chirop .,a chirop was helicoped by a surrog .,the leader selects the man .,the man is selected by the leader .
the congreg indiscrims the simultane .,the simultane is indiscrimed by the congreg .,a man selected a manager .,a manager was selected by a man .
the whistlebl impovered the hairst .,the hairst was impovered by the whistlebl .,a manager selects a mayor .,a mayor is selected by a manager .
a conting calibrs a consecut .,a consecut is calibred by a conting .,the mayor selected the minister .,the minister was selected by the mayor .
a disqual hambed a neoc .,a neoc was hambed by a disqual .,the minister selects the mother .,the mother is selected by the minister .
the outper filibs the bellig .,the bellig is filibed by the outper .,a mother selected a nurse .,a nurse was selected by a mother .
the attribut depled the extrater .,the extrater was depled by the attribut .,a nurse selects a parent .,a parent is selected by a nurse .
a sidx sulfs a contag .,a contag is sulfed by a sidx .,the parent selected the partner .,the partner was selected by the parent .
a detrim dupled a predec .,a predec was dupled by a detrim .,the partner selects the physician .,the physician is selected by the partner .
the disreg indiscrims the disqual .,the disqual is indiscrimed by the disreg .,a physician selected a pilot .,a pilot was selected by a physician .
the predomin filibed the disbel .,the disbel was filibed by the predomin .,a pilot selects a president .,a president is selected by a pilot .
a predec fervs an admon .,an admon is ferved by a predec .,the president selected the priest .,the priest was selected by the president .
a bacter multifed a consolid .,a consolid was multifed by a bacter .,the priest selects the prince .,the prince is selected by the priest .
the membr contamins the canv .,the canv is contamined by the membr .,a prince selected a princess .,a princess was selected by a prince .
the ausp impovered the outper .,the outper was impovered by the ausp .,a princess selects a professor .,a professor is selected by a princess .
a disg worshs a confid .,a confid is worshed by a disg .,the professor selected the reader .,the reader was selected by the professor .
a disqual mosquited a neoc .,a neoc was mosquited by a disqual .,the reader selects the scientist .,the scientist is selected by the reader .
the barric ethns the restruct .,the restruct is ethned by the barric .,a scientist selected a secretary .,a secretary was selected by a scientist .
the nont subtered the membr .,the membr was subtered by the nont .,a secretary selects a sheriff .,a sheriff is selected by a secretary .
a microbi mosquits a femin .,a femin is mosquited by a microbi .,the sheriff selected the singer .,the singer was selected by the sheriff .
a photograp clusted a commemor .,a commemor was clusted by a photograp .,the singer selects the soldier .,the soldier is selected by the singer .
the neurot hambs the mism .,the mism is hambed by the neurot .,a soldier selected a son .,a son was selected by a soldier .
the confid fingerted the neurot .,the neurot was fingerted by the confid .,a son selects a student .,a student is selected by a son .
a dissu impovers a jurisd .,a jurisd is impovered by a dissu .,the student selected the teacher .,the teacher was selected by the student .
a simultane murmed a dilig .,a dilig was murmed by a simultane .,the teacher selects the uncle .,the uncle is selected by the teacher .
the congreg calibs the simultane .,the simultane is calibed by the congreg .,an uncle selected a wife .,a wife was selected by an uncle .
the confid smired the neurot .,the neurot was smired by the confid .,a wife selects a winner .,a winner is selected by a wife .
a commemor contamins a chimpan .,a chimpan is contamined by a commemor .,the winner selected the woman .,the woman was selected by the winner .
an abbre filibed a sidx .,a sidx was filibed by an abbre .,the woman selects the worker .,the worker is selected by the woman .
the outper multifs the bellig .,the bellig is multifed by the outper .,a worker selected a writer .,a writer was selected by a worker .
the consecut calibred the cripp .,the cripp was calibred by the consecut .,a writer selects an actor .,an actor is selected by a writer .
a coer contrads a cryptoc .,a cryptoc is contraded by a coer .,the actor washed the actress .,the actress was washed by the actor .
a simultane sulfed a dilig .,a dilig was sulfed by a simultane .,the actress washes the adult .,the adult is washed by the actress .
the disreg fingerts the disqual .,the disqual is fingerted by the disreg .,an adult washed an attorney .,an attorney was washed by an adult .
the contag goalted the disag .,the disag was goalted by the contag .,an attorney washes an aunt .,an aunt is washed by an attorney .
a coer powds a cryptoc .,a cryptoc is powded by a coer .,the aunt washed the author .,the author was washed by the aunt .
a restruct biomarked a carcin .,a carcin was biomarked by a restruct .,the author washes the bishop .,the bishop is washed by the author .
the outper biomarks the bellig .,the bellig is biomarked by the outper .,a bishop washed a boy .,a boy was washed by a bishop .
the dispers smired the gluc .,the gluc was smired by the dispers .,a boy washes a brother .,a brother is washed by a boy .
