pa,pp,ta,tp
an actress catches an adult .,an adult is caught by an actress .,a leader catches a man .,a man is caught by a leader .
a mayor teaches a minister .,a minister is taught by a mayor .,an attorney teaches an aunt .,an aunt is taught by an attorney .
a pilot forgives a president .,a president is forgiven by a pilot .,a captain forgives a champion .,a champion is forgiven by a captain .
a student teaches a teacher .,a teacher is taught by a student .,a girl teaches a guest .,a guest is taught by a girl .
a child forgives a colonel .,a colonel is forgiven by a child .,a priest forgives a prince .,a prince is forgiven by a priest .
a girl discovers a guest .,a guest is discovered by a girl .,a son discovers a student .,a student is discovered by a son .
a reader hurries a scientist .,a scientist is hurried by a reader .,a cousin hurries a daughter .,a daughter is hurried by a cousin .
a leader kills a man .,a man is killed by a leader .,an actor kills an actress .,an actress is killed by an actor .
a brother drags a buddy .,a buddy is dragged by a brother .,an opponent drags a parent .,a parent is dragged by an opponent .
a teacher embraces an uncle .,an uncle is embraced by a teacher .,a guest embraces a guy .,a guy is embraced by a guest .
a lady describes a lawyer .,a lawyer is described by a lady .,a worker describes a writer .,a writer is described by a worker .
a doctor protects an employee .,an employee is protected by a doctor .,a scientist protects a secretary .,a secretary is protected by a scientist .
a son carries a student .,a student is carried by a son .,a friend carries a girl .,a girl is carried by a friend .
a wife hurts a winner .,a winner is hurt by a wife .,a hero hurts a husband .,a husband is hurt by a hero .
a friend selects a girl .,a girl is selected by a friend .,a soldier selects a son .,a son is selected by a soldier .
an employer washes a father .,a father is washed by an employer .,a sheriff washes a singer .,a singer is washed by a sheriff .
a doctor joins an employee .,an employee is joined by a doctor .,a scientist joins a secretary .,a secretary is joined by a scientist .
a leader washes a man .,a man is washed by a leader .,an actor washes an actress .,an actress is washed by an actor .
an actor hurries an actress .,an actress is hurried by an actor .,a lawyer hurries a leader .,a leader is hurried by a lawyer .
an actor understands an actress .,an actress is understood by an actor .,a lawyer understands a leader .,a leader is understood by a lawyer .
an employee kisses an employer .,an employer is kissed by an employee .,a secretary kisses a sheriff .,a sheriff is kissed by a secretary .
a pilot helps a president .,a president is helped by a pilot .,a captain helps a champion .,a champion is helped by a captain .
a writer forgets an actor .,an actor is forgotten by a writer .,a lady forgets a lawyer .,a lawyer is forgotten by a lady .
a mother helps a nurse .,a nurse is helped by a mother .,an author helps a bishop .,a bishop is helped by an author .
a prince forgives a princess .,a princess is forgiven by a prince .,a child forgives a colonel .,a colonel is forgiven by a child .
a student destroys a teacher .,a teacher is destroyed by a student .,a girl destroys a guest .,a guest is destroyed by a girl .
a mayor hurts a minister .,a minister is hurt by a mayor .,an attorney hurts an aunt .,an aunt is hurt by an attorney .
a child drags a colonel .,a colonel is dragged by a child .,a priest drags a prince .,a prince is dragged by a priest .
a cop forgives a cousin .,a cousin is forgiven by a cop .,a princess forgives a professor .,a professor is forgiven by a princess .
a woman hurts a worker .,a worker is hurt by a woman .,a kid hurts a king .,a king is hurt by a kid .
a professor discovers a reader .,a reader is discovered by a professor .,a cop discovers a cousin .,a cousin is discovered by a cop .
a teacher follows an uncle .,an uncle is followed by a teacher .,a guest follows a guy .,a guy is followed by a guest .
a son teaches a student .,a student is taught by a son .,a friend teaches a girl .,a girl is taught by a friend .
a cousin forgets a daughter .,a daughter is forgotten by a cousin .,a professor forgets a reader .,a reader is forgotten by a professor .
a friend protects a girl .,a girl is protected by a friend .,a soldier protects a son .,a son is protected by a soldier .
a professor protects a reader .,a reader is protected by a professor .,a cop protects a cousin .,a cousin is protected by a cop .
a prince discovers a princess .,a princess is discovered by a prince .,a child discovers a colonel .,a colonel is discovered by a child .
a bishop forgives a boy .,a boy is forgiven by a bishop .,a mother forgives a nurse .,a nurse is forgiven by a mother .
a president grabs a priest .,a priest is grabbed by a president .,a champion grabs a chief .,a chief is grabbed by a champion .
a boy chases a brother .,a brother is chased by a boy .,a nurse chases an opponent .,an opponent is chased by a nurse .
a scientist grabs a secretary .,a secretary is grabbed by a scientist .,a daughter grabs a doctor .,a doctor is grabbed by a daughter .
a guest teaches a guy .,a guy is taught by a guest .,a student teaches a teacher .,a teacher is taught by a student .
a guest punches a guy .,a guy is punched by a guest .,a student punches a teacher .,a teacher is punched by a student .
a cop punches a cousin .,a cousin is punched by a cop .,a princess punches a professor .,a professor is punched by a princess .
an adult teaches an attorney .,an attorney is taught by an adult .,a man teaches a manager .,a manager is taught by a man .
a teacher washes an uncle .,an uncle is washed by a teacher .,a guest washes a guy .,a guy is washed by a guest .
an aunt forgives an author .,an author is forgiven by an aunt .,a mayor forgives a minister .,a minister is forgiven by a mayor .
a cousin strikes a daughter .,a daughter is struck by a cousin .,a professor strikes a reader .,a reader is struck by a professor .
a student embraces a teacher .,a teacher is embraced by a student .,a girl embraces a guest .,a guest is embraced by a girl .
a girl asks a guest .,a guest is asked by a girl .,a son asks a student .,a student is asked by a son .
a lady grabs a lawyer .,a lawyer is grabbed by a lady .,a worker grabs a writer .,a writer is grabbed by a worker .
an actress kisses an adult .,an adult is kissed by an actress .,a leader kisses a man .,a man is kissed by a leader .
a physician hurries a pilot .,a pilot is hurried by a physician .,a candidate hurries a captain .,a captain is hurried by a candidate .
a hero discovers a husband .,a husband is discovered by a hero .,an uncle discovers a wife .,a wife is discovered by an uncle .
a singer teaches a soldier .,a soldier is taught by a singer .,an employer teaches a father .,a father is taught by an employer .
a parent grabs a partner .,a partner is grabbed by a parent .,a brother grabs a buddy .,a buddy is grabbed by a brother .
a teacher helps an uncle .,an uncle is helped by a teacher .,a guest helps a guy .,a guy is helped by a guest .
a minister understands a mother .,a mother is understood by a minister .,an aunt understands an author .,an author is understood by an aunt .
a boy washes a brother .,a brother is washed by a boy .,a nurse washes an opponent .,an opponent is washed by a nurse .
a sheriff chases a singer .,a singer is chased by a sheriff .,an employee chases an employer .,an employer is chased by an employee .
an actor washes an actress .,an actress is washed by an actor .,a lawyer washes a leader .,a leader is washed by a lawyer .
a parent washes a partner .,a partner is washed by a parent .,a brother washes a buddy .,a buddy is washed by a brother .
a kid raises a king .,a king is raised by a kid .,a winner raises a woman .,a woman is raised by a winner .
a physician hurts a pilot .,a pilot is hurt by a physician .,a candidate hurts a captain .,a captain is hurt by a candidate .
a king punches a lady .,a lady is punched by a king .,a woman punches a worker .,a worker is punched by a woman .
a friend forgets a girl .,a girl is forgotten by a friend .,a soldier forgets a son .,a son is forgotten by a soldier .
a president teaches a priest .,a priest is taught by a president .,a champion teaches a chief .,a chief is taught by a champion .
a lawyer follows a leader .,a leader is followed by a lawyer .,a writer follows an actor .,an actor is followed by a writer .
a reader protects a scientist .,a scientist is protected by a reader .,a cousin protects a daughter .,a daughter is protected by a cousin .
a kid beats a king .,a king is beaten by a kid .,a winner beats a woman .,a woman is beaten by a winner .
a chief understands a child .,a child is understood by a chief .,a president understands a priest .,a priest is understood by a president .
a princess comforts a professor .,a professor is comforted by a princess .,a colonel comforts a cop .,a cop is comforted by a colonel .
a physician drags a pilot .,a pilot is dragged by a physician .,a candidate drags a captain .,a captain is dragged by a candidate .
a reader kills a scientist .,a scientist is killed by a reader .,a cousin kills a daughter .,a daughter is killed by a cousin .
a captain carries a champion .,a champion is carried by a captain .,a physician carries a pilot .,a pilot is carried by a physician .
a partner beats a physician .,a physician is beaten by a partner .,a buddy beats a candidate .,a candidate is beaten by a buddy .
a father joins a friend .,a friend is joined by a father .,a singer joins a soldier .,a soldier is joined by a singer .
a minister destroys a mother .,a mother is destroyed by a minister .,an aunt destroys an author .,an author is destroyed by an aunt .
a president helps a priest .,a priest is helped by a president .,a champion helps a chief .,a chief is helped by a champion .
a president comforts a priest .,a priest is comforted by a president .,a champion comforts a chief .,a chief is comforted by a champion .
an actress drags an adult .,an adult is dragged by an actress .,a leader drags a man .,a man is dragged by a leader .
an uncle kisses a wife .,a wife is kissed by an uncle .,a guy kisses a hero .,a hero is kissed by a guy .
an attorney judges an aunt .,an aunt is judged by an attorney .,a manager judges a mayor .,a mayor is judged by a manager .
an employee helps an employer .,an employer is helped by an employee .,a secretary helps a sheriff .,a sheriff is helped by a secretary .
a son bothers a student .,a student is bothered by a son .,a friend bothers a girl .,a girl is bothered by a friend .
a partner chases a physician .,a physician is chased by a partner .,a buddy chases a candidate .,a candidate is chased by a buddy .
a mayor raises a minister .,a minister is raised by a mayor .,an attorney raises an aunt .,an aunt is raised by an attorney .
a guest surprises a guy .,a guy is surprised by a guest .,a student surprises a teacher .,a teacher is surprised by a student .
an opponent carries a parent .,a parent is carried by an opponent .,a boy carries a brother .,a brother is carried by a boy .
an aunt beats an author .,an author is beaten by an aunt .,a mayor beats a minister .,a minister is beaten by a mayor .
a sheriff helps a singer .,a singer is helped by a sheriff .,an employee helps an employer .,an employer is helped by an employee .
a father raises a friend .,a friend is raised by a father .,a singer raises a soldier .,a soldier is raised by a singer .
a hero asks a husband .,a husband is asked by a hero .,an uncle asks a wife .,a wife is asked by an uncle .
a mother joins a nurse .,a nurse is joined by a mother .,an author joins a bishop .,a bishop is joined by an author .
a colonel protects a cop .,a cop is protected by a colonel .,a prince protects a princess .,a princess is protected by a prince .
a cop describes a cousin .,a cousin is described by a cop .,a princess describes a professor .,a professor is described by a princess .
a daughter helps a doctor .,a doctor is helped by a daughter .,a reader helps a scientist .,a scientist is helped by a reader .
a secretary raises a sheriff .,a sheriff is raised by a secretary .,a doctor raises an employee .,an employee is raised by a doctor .
an aunt follows an author .,an author is followed by an aunt .,a mayor follows a minister .,a minister is followed by a mayor .
a champion joins a chief .,a chief is joined by a champion .,a pilot joins a president .,a president is joined by a pilot .
a buddy beats a candidate .,a candidate is beaten by a buddy .,a parent beats a partner .,a partner is beaten by a parent .
a boy kisses a brother .,a brother is kissed by a boy .,a nurse kisses an opponent .,an opponent is kissed by a nurse .
an author forgives a bishop .,a bishop is forgiven by an author .,a minister forgives a mother .,a mother is forgiven by a minister .
a professor raises a reader .,a reader is raised by a professor .,a cop raises a cousin .,a cousin is raised by a cop .
a sheriff protects a singer .,a singer is protected by a sheriff .,an employee protects an employer .,an employer is protected by an employee .
a cousin protects a daughter .,a daughter is protected by a cousin .,a professor protects a reader .,a reader is protected by a professor .
a girl joins a guest .,a guest is joined by a girl .,a son joins a student .,a student is joined by a son .
a cousin asks a daughter .,a daughter is asked by a cousin .,a professor asks a reader .,a reader is asked by a professor .
a daughter asks a doctor .,a doctor is asked by a daughter .,a reader asks a scientist .,a scientist is asked by a reader .
a colonel strikes a cop .,a cop is struck by a colonel .,a prince strikes a princess .,a princess is struck by a prince .
a nurse hurts an opponent .,an opponent is hurt by a nurse .,a bishop hurts a boy .,a boy is hurt by a bishop .
a daughter bothers a doctor .,a doctor is bothered by a daughter .,a reader bothers a scientist .,a scientist is bothered by a reader .
a guy bothers a hero .,a hero is bothered by a guy .,a teacher bothers an uncle .,an uncle is bothered by a teacher .
an employee beats an employer .,an employer is beaten by an employee .,a secretary beats a sheriff .,a sheriff is beaten by a secretary .
a lady comforts a lawyer .,a lawyer is comforted by a lady .,a worker comforts a writer .,a writer is comforted by a worker .
a teacher destroys an uncle .,an uncle is destroyed by a teacher .,a guest destroys a guy .,a guy is destroyed by a guest .
a buddy joins a candidate .,a candidate is joined by a buddy .,a parent joins a partner .,a partner is joined by a parent .
a woman understands a worker .,a worker is understood by a woman .,a kid understands a king .,a king is understood by a kid .
a guy raises a hero .,a hero is raised by a guy .,a teacher raises an uncle .,an uncle is raised by a teacher .
an uncle hurts a wife .,a wife is hurt by an uncle .,a guy hurts a hero .,a hero is hurt by a guy .
a nurse understands an opponent .,an opponent is understood by a nurse .,a bishop understands a boy .,a boy is understood by a bishop .
a lady understands a lawyer .,a lawyer is understood by a lady .,a worker understands a writer .,a writer is understood by a worker .
a chief washes a child .,a child is washed by a chief .,a president washes a priest .,a priest is washed by a president .
a sheriff beats a singer .,a singer is beaten by a sheriff .,an employee beats an employer .,an employer is beaten by an employee .
a man destroys a manager .,a manager is destroyed by a man .,an actress destroys an adult .,an adult is destroyed by an actress .
a captain helps a champion .,a champion is helped by a captain .,a physician helps a pilot .,a pilot is helped by a physician .
a cop raises a cousin .,a cousin is raised by a cop .,a princess raises a professor .,a professor is raised by a princess .
a boy surprises a brother .,a brother is surprised by a boy .,a nurse surprises an opponent .,an opponent is surprised by a nurse .
a girl helps a guest .,a guest is helped by a girl .,a son helps a student .,a student is helped by a son .
a secretary chases a sheriff .,a sheriff is chased by a secretary .,a doctor chases an employee .,an employee is chased by a doctor .
a brother teaches a buddy .,a buddy is taught by a brother .,an opponent teaches a parent .,a parent is taught by an opponent .
a cop follows a cousin .,a cousin is followed by a cop .,a princess follows a professor .,a professor is followed by a princess .
a wife carries a winner .,a winner is carried by a wife .,a hero carries a husband .,a husband is carried by a hero .
a nurse forgives an opponent .,an opponent is forgiven by a nurse .,a bishop forgives a boy .,a boy is forgiven by a bishop .
a bishop hurries a boy .,a boy is hurried by a bishop .,a mother hurries a nurse .,a nurse is hurried by a mother .
a captain beats a champion .,a champion is beaten by a captain .,a physician beats a pilot .,a pilot is beaten by a physician .
an aunt bothers an author .,an author is bothered by an aunt .,a mayor bothers a minister .,a minister is bothered by a mayor .
a doctor kisses an employee .,an employee is kissed by a doctor .,a scientist kisses a secretary .,a secretary is kissed by a scientist .
a nurse destroys an opponent .,an opponent is destroyed by a nurse .,a bishop destroys a boy .,a boy is destroyed by a bishop .
a boy carries a brother .,a brother is carried by a boy .,a nurse carries an opponent .,an opponent is carried by a nurse .
a daughter forgives a doctor .,a doctor is forgiven by a daughter .,a reader forgives a scientist .,a scientist is forgiven by a reader .
an adult chases an attorney .,an attorney is chased by an adult .,a man chases a manager .,a manager is chased by a man .
a soldier washes a son .,a son is washed by a soldier .,a father washes a friend .,a friend is washed by a father .
a girl comforts a guest .,a guest is comforted by a girl .,a son comforts a student .,a student is comforted by a son .
a brother carries a buddy .,a buddy is carried by a brother .,an opponent carries a parent .,a parent is carried by an opponent .
a cousin hurries a daughter .,a daughter is hurried by a cousin .,a professor hurries a reader .,a reader is hurried by a professor .
a woman beats a worker .,a worker is beaten by a woman .,a kid beats a king .,a king is beaten by a kid .
a kid discovers a king .,a king is discovered by a kid .,a winner discovers a woman .,a woman is discovered by a winner .
a girl understands a guest .,a guest is understood by a girl .,a son understands a student .,a student is understood by a son .
a kid destroys a king .,a king is destroyed by a kid .,a winner destroys a woman .,a woman is destroyed by a winner .
a friend helps a girl .,a girl is helped by a friend .,a soldier helps a son .,a son is helped by a soldier .
a partner bothers a physician .,a physician is bothered by a partner .,a buddy bothers a candidate .,a candidate is bothered by a buddy .
a kid understands a king .,a king is understood by a kid .,a winner understands a woman .,a woman is understood by a winner .
a leader catches a man .,a man is caught by a leader .,an actor catches an actress .,an actress is caught by an actor .
an employee understands an employer .,an employer is understood by an employee .,a secretary understands a sheriff .,a sheriff is understood by a secretary .
a guest carries a guy .,a guy is carried by a guest .,a student carries a teacher .,a teacher is carried by a student .
a candidate raises a captain .,a captain is raised by a candidate .,a partner raises a physician .,a physician is raised by a partner .
a girl drags a guest .,a guest is dragged by a girl .,a son drags a student .,a student is dragged by a son .
a writer surprises an actor .,an actor is surprised by a writer .,a lady surprises a lawyer .,a lawyer is surprised by a lady .
a cousin kills a daughter .,a daughter is killed by a cousin .,a professor kills a reader .,a reader is killed by a professor .
an adult follows an attorney .,an attorney is followed by an adult .,a man follows a manager .,a manager is followed by a man .
an attorney hurts an aunt .,an aunt is hurt by an attorney .,a manager hurts a mayor .,a mayor is hurt by a manager .
a scientist punches a secretary .,a secretary is punched by a scientist .,a daughter punches a doctor .,a doctor is punched by a daughter .
a secretary destroys a sheriff .,a sheriff is destroyed by a secretary .,a doctor destroys an employee .,an employee is destroyed by a doctor .
a kid punches a king .,a king is punched by a kid .,a winner punches a woman .,a woman is punched by a winner .
a cousin comforts a daughter .,a daughter is comforted by a cousin .,a professor comforts a reader .,a reader is comforted by a professor .
a soldier teaches a son .,a son is taught by a soldier .,a father teaches a friend .,a friend is taught by a father .
a son follows a student .,a student is followed by a son .,a friend follows a girl .,a girl is followed by a friend .
a soldier carries a son .,a son is carried by a soldier .,a father carries a friend .,a friend is carried by a father .
an employee joins an employer .,an employer is joined by an employee .,a secretary joins a sheriff .,a sheriff is joined by a secretary .
a wife asks a winner .,a winner is asked by a wife .,a hero asks a husband .,a husband is asked by a hero .
a king washes a lady .,a lady is washed by a king .,a woman washes a worker .,a worker is washed by a woman .
a captain embraces a champion .,a champion is embraced by a captain .,a physician embraces a pilot .,a pilot is embraced by a physician .
a priest teaches a prince .,a prince is taught by a priest .,a chief teaches a child .,a child is taught by a chief .
an adult grabs an attorney .,an attorney is grabbed by an adult .,a man grabs a manager .,a manager is grabbed by a man .
an author raises a bishop .,a bishop is raised by an author .,a minister raises a mother .,a mother is raised by a minister .
a student joins a teacher .,a teacher is joined by a student .,a girl joins a guest .,a guest is joined by a girl .
a soldier strikes a son .,a son is struck by a soldier .,a father strikes a friend .,a friend is struck by a father .
a lawyer comforts a leader .,a leader is comforted by a lawyer .,a writer comforts an actor .,an actor is comforted by a writer .
an adult beats an attorney .,an attorney is beaten by an adult .,a man beats a manager .,a manager is beaten by a man .
a lawyer joins a leader .,a leader is joined by a lawyer .,a writer joins an actor .,an actor is joined by a writer .
an employee comforts an employer .,an employer is comforted by an employee .,a secretary comforts a sheriff .,a sheriff is comforted by a secretary .
a champion surprises a chief .,a chief is surprised by a champion .,a pilot surprises a president .,a president is surprised by a pilot .
a writer comforts an actor .,an actor is comforted by a writer .,a lady comforts a lawyer .,a lawyer is comforted by a lady .
a physician forgets a pilot .,a pilot is forgotten by a physician .,a candidate forgets a captain .,a captain is forgotten by a candidate .
a hero drags a husband .,a husband is dragged by a hero .,an uncle drags a wife .,a wife is dragged by an uncle .
a soldier forgives a son .,a son is forgiven by a soldier .,a father forgives a friend .,a friend is forgiven by a father .
a chief surprises a child .,a child is surprised by a chief .,a president surprises a priest .,a priest is surprised by a president .
an employee follows an employer .,an employer is followed by an employee .,a secretary follows a sheriff .,a sheriff is followed by a secretary .
a bishop describes a boy .,a boy is described by a bishop .,a mother describes a nurse .,a nurse is described by a mother .
a worker kisses a writer .,a writer is kissed by a worker .,a king kisses a lady .,a lady is kissed by a king .
a boy teaches a brother .,a brother is taught by a boy .,a nurse teaches an opponent .,an opponent is taught by a nurse .
a guy protects a hero .,a hero is protected by a guy .,a teacher protects an uncle .,an uncle is protected by a teacher .
a manager forgives a mayor .,a mayor is forgiven by a manager .,an adult forgives an attorney .,an attorney is forgiven by an adult .
a secretary washes a sheriff .,a sheriff is washed by a secretary .,a doctor washes an employee .,an employee is washed by a doctor .
an adult drags an attorney .,an attorney is dragged by an adult .,a man drags a manager .,a manager is dragged by a man .
a hero hurries a husband .,a husband is hurried by a hero .,an uncle hurries a wife .,a wife is hurried by an uncle .
a professor asks a reader .,a reader is asked by a professor .,a cop asks a cousin .,a cousin is asked by a cop .
a parent teaches a partner .,a partner is taught by a parent .,a brother teaches a buddy .,a buddy is taught by a brother .
a lawyer hurts a leader .,a leader is hurt by a lawyer .,a writer hurts an actor .,an actor is hurt by a writer .
an adult raises an attorney .,an attorney is raised by an adult .,a man raises a manager .,a manager is raised by a man .
a guy hurts a hero .,a hero is hurt by a guy .,a teacher hurts an uncle .,an uncle is hurt by a teacher .
a prince selects a princess .,a princess is selected by a prince .,a child selects a colonel .,a colonel is selected by a child .
a priest punches a prince .,a prince is punched by a priest .,a chief punches a child .,a child is punched by a chief .
a winner teaches a woman .,a woman is taught by a winner .,a husband teaches a kid .,a kid is taught by a husband .
