pa,pp,ta,tp
the astroph carnivs the abund .,the abund is carnived by the astroph .,a candidate killed a captain .,a captain was killed by a candidate .
the consecut depled the cripp .,the cripp was depled by the consecut .,a captain kills a champion .,a champion is killed by a captain .
a carcin fervs an attribut .,an attribut is ferved by a carcin .,the champion killed the chief .,the chief was killed by the champion .
a bellig veterined a coer .,a coer was veterined by a bellig .,the chief kills the child .,the child is killed by the chief .
the disbel depls the photograp .,the photograp is depled by the disbel .,a child killed a colonel .,a colonel was killed by a child .
the confid dupled the neurot .,the neurot was dupled by the confid .,a colonel kills a cop .,a cop is killed by a colonel .
a kilomet handcs a pedd .,a pedd is handced by a kilomet .,the cop killed the cousin .,the cousin was killed by the cop .
a neglig clusted a dissu .,a dissu was clusted by a neglig .,the cousin kills the daughter .,the daughter is killed by the cousin .
the disag reapps the detrim .,the detrim is reapped by the disag .,a daughter killed a doctor .,a doctor was killed by a daughter .
the nont ethned the membr .,the membr was ethned by the nont .,a doctor kills an employee .,an employee is killed by a doctor .
an accommod clusts an ausp .,an ausp is clusted by an accommod .,the employee killed the employer .,the employer was killed by the employee .
a restruct sulfed a carcin .,a carcin was sulfed by a restruct .,the employer kills the father .,the father is killed by the employer .
the neurot indiscrims the mism .,the mism is indiscrimed by the neurot .,a father killed a friend .,a friend was killed by a father .
the nont worshed the membr .,the membr was worshed by the nont .,a friend kills a girl .,a girl is killed by a friend .
a siph smirs a dispers .,a dispers is smired by a siph .,the girl killed the guest .,the guest was killed by the girl .
a neglig contamined a dissu .,a dissu was contamined by a neglig .,the guest kills the guy .,the guy is killed by the guest .
the disbel veterins the photograp .,the photograp is veterined by the disbel .,a guy killed a hero .,a hero was killed by a guy .
the jurisd clusted the congreg .,the congreg was clusted by the jurisd .,a hero kills a husband .,a husband is killed by a hero .
a dissu powds a jurisd .,a jurisd is powded by a dissu .,the husband killed the kid .,the kid was killed by the husband .
a certific goalted a conting .,a conting was goalted by a certific .,the kid kills the king .,the king is killed by the kid .
the barric dupls the restruct .,the restruct is dupled by the barric .,a king killed a lady .,a lady was killed by a king .
the admon ferved the astroph .,the astroph was ferved by the admon .,a lady kills a lawyer .,a lawyer is killed by a lady .
a predec calibs an admon .,an admon is calibed by a predec .,the lawyer killed the leader .,the leader was killed by the lawyer .
a detrim smired a predec .,a predec was smired by a detrim .,the leader kills the man .,the man is killed by the leader .
the outper subters the bellig .,the bellig is subtered by the outper .,a man killed a manager .,a manager was killed by a man .
the attribut reapped the extrater .,the extrater was reapped by the attribut .,a manager kills a mayor .,a mayor is killed by a manager .
a kilomet calibs a pedd .,a pedd is calibed by a kilomet .,the mayor killed the minister .,the minister was killed by the mayor .
a mism biomarked a microbi .,a microbi was biomarked by a mism .,the minister kills the mother .,the mother is killed by the minister .
the extrater filibs the surrog .,the surrog is filibed by the extrater .,a mother killed a nurse .,a nurse was killed by a mother .
the attribut biomarked the extrater .,the extrater was biomarked by the attribut .,a nurse kills a parent .,a parent is killed by a nurse .
a conting celebrs a consecut .,a consecut is celebred by a conting .,the parent killed the partner .,the partner was killed by the parent .
a mism helicoped a microbi .,a microbi was helicoped by a mism .,the partner kills the physician .,the physician is killed by the partner .
the disbel fingerts the photograp .,the photograp is fingerted by the disbel .,a physician killed a pilot .,a pilot was killed by a physician .
the whistlebl celebred the hairst .,the hairst was celebred by the whistlebl .,a pilot kills a president .,a president is killed by a pilot .
a dissu depls a jurisd .,a jurisd is depled by a dissu .,the president killed the priest .,the priest was killed by the president .
a simultane worshed a dilig .,a dilig was worshed by a simultane .,the priest kills the prince .,the prince is killed by the priest .
the disbel multifs the photograp .,the photograp is multifed by the disbel .,a prince killed a princess .,a princess was killed by a prince .
the nont smired the membr .,the membr was smired by the nont .,a princess kills a professor .,a professor is killed by a princess .
a carcin indiscrims an attribut .,an attribut is indiscrimed by a carcin .,the professor killed the reader .,the reader was killed by the professor .
a mism reapped a microbi .,a microbi was reapped by a mism .,the reader kills the scientist .,the scientist is killed by the reader .
the barric hambs the restruct .,the restruct is hambed by the barric .,a scientist killed a secretary .,a secretary was killed by a scientist .
the dispers helicoped the gluc .,the gluc was helicoped by the dispers .,a secretary kills a sheriff .,a sheriff is killed by a secretary .
a predec fingerts an admon .,an admon is fingerted by a predec .,the sheriff killed the singer .,the singer was killed by the sheriff .
a mism sulfed a microbi .,a microbi was sulfed by a mism .,the singer kills the soldier .,the soldier is killed by the singer .
the astroph helicops the abund .,the abund is helicoped by the astroph .,a soldier killed a son .,a son was killed by a soldier .
the davidjl carnived the conspic .,the conspic was carnived by the davidjl .,a son kills a student .,a student is killed by a son .
a conting contrads a consecut .,a consecut is contraded by a conting .,the student killed the teacher .,the teacher was killed by the student .
a mism subtered a microbi .,a microbi was subtered by a mism .,the teacher kills the uncle .,the uncle is killed by the teacher .
the extrater fervs the surrog .,the surrog is ferved by the extrater .,an uncle killed a wife .,a wife was killed by an uncle .
the ausp celebred the outper .,the outper was celebred by the ausp .,a wife kills a winner .,a winner is killed by a wife .
a siph ethns a dispers .,a dispers is ethned by a siph .,the winner killed the woman .,the woman was killed by the winner .
a disqual depled a neoc .,a neoc was depled by a disqual .,the woman kills the worker .,the worker is killed by the woman .
the gluc dupls the malf .,the malf is dupled by the gluc .,a worker killed a writer .,a writer was killed by a worker .
the cryptoc discled the burgl .,the burgl was discled by the cryptoc .,a writer kills an actor .,an actor is killed by a writer .
a dissu handcs a jurisd .,a jurisd is handced by a dissu .,the actor kissed the actress .,the actress was kissed by the actor .
a disqual reapped a neoc .,a neoc was reapped by a disqual .,the actress kisses the adult .,the adult is kissed by the actress .
the collabor discls the neglig .,the neglig is discled by the collabor .,an adult kissed an attorney .,an attorney was kissed by an adult .
the ausp clusted the outper .,the outper was clusted by the ausp .,an attorney kisses an aunt .,an aunt is kissed by an attorney .
a conting calibs a consecut .,a consecut is calibed by a conting .,the aunt kissed the author .,the author was kissed by the aunt .
a certific impovered a conting .,a conting was impovered by a certific .,the author kisses the bishop .,the bishop is kissed by the author .
the disbel calibrs the photograp .,the photograp is calibred by the disbel .,a bishop kissed a boy .,a boy was kissed by a bishop .
the pedd sulfed the barric .,the barric was sulfed by the pedd .,a boy kisses a brother .,a brother is kissed by a boy .
a kilomet contamins a pedd .,a pedd is contamined by a kilomet .,the brother kissed the buddy .,the buddy was kissed by the brother .
an abund nonded an accommod .,an accommod was nonded by an abund .,the buddy kisses the candidate .,the candidate is kissed by the buddy .
the cripp sulfs the fluct .,the fluct is sulfed by the cripp .,a candidate kissed a captain .,a captain was kissed by a candidate .
the ausp ethned the outper .,the outper was ethned by the ausp .,a captain kisses a champion .,a champion is kissed by a captain .
a coer multifs a cryptoc .,a cryptoc is multifed by a coer .,the champion kissed the chief .,the chief was kissed by the champion .
a restruct clusted a carcin .,a carcin was clusted by a restruct .,the chief kisses the child .,the child is kissed by the chief .
the disbel sulfs the photograp .,the photograp is sulfed by the disbel .,a child kissed a colonel .,a colonel was kissed by a child .
the chimpan clusted the disreg .,the disreg was clusted by the chimpan .,a colonel kisses a cop .,a cop is kissed by a colonel .
a predec hambs an admon .,an admon is hambed by a predec .,the cop kissed the cousin .,the cousin was kissed by the cop .
a disqual biomarked a neoc .,a neoc was biomarked by a disqual .,the cousin kisses the daughter .,the daughter is kissed by the cousin .
the barric powds the restruct .,the restruct is powded by the barric .,a daughter kissed a doctor .,a doctor was kissed by a daughter .
the ausp ferved the outper .,the outper was ferved by the ausp .,a doctor kisses an employee .,an employee is kissed by a doctor .
a disg clusts a confid .,a confid is clusted by a disg .,the employee kissed the employer .,the employer was kissed by the employee .
a certific dupled a conting .,a conting was dupled by a certific .,the employer kisses the father .,the father is kissed by the employer .
the astroph contrads the abund .,the abund is contraded by the astroph .,a father kissed a friend .,a friend was kissed by a father .
the cryptoc goalted the burgl .,the burgl was goalted by the cryptoc .,a friend kisses a girl .,a girl is kissed by a friend .
a chirop dupls a nont .,a nont is dupled by a chirop .,the girl kissed the guest .,the guest was kissed by the girl .
a neglig fingerted a dissu .,a dissu was fingerted by a neglig .,the guest kisses the guy .,the guy is kissed by the guest .
the disreg clusts the disqual .,the disqual is clusted by the disreg .,a guy kissed a hero .,a hero was kissed by a guy .
the confid sulfed the neurot .,the neurot was sulfed by the confid .,a hero kisses a husband .,a husband is kissed by a hero .
a dissu worshs a jurisd .,a jurisd is worshed by a dissu .,the husband kissed the kid .,the kid was kissed by the husband .
a malf dupled a disg .,a disg was dupled by a malf .,the kid kisses the king .,the king is kissed by the kid .
the burgl filibs the certific .,the certific is filibed by the burgl .,a king kissed a lady .,a lady was kissed by a king .
the confid worshed the neurot .,the neurot was worshed by the confid .,a lady kisses a lawyer .,a lawyer is kissed by a lady .
a disg biomarks a confid .,a confid is biomarked by a disg .,the lawyer kissed the leader .,the leader was kissed by the lawyer .
a surrog impovered a chirop .,a chirop was impovered by a surrog .,the leader kisses the man .,the man is kissed by the leader .
the congreg multifs the simultane .,the simultane is multifed by the congreg .,a man kissed a manager .,a manager was kissed by a man .
the cryptoc fingerted the burgl .,the burgl was fingerted by the cryptoc .,a manager kisses a mayor .,a mayor is kissed by a manager .
a sidx fingerts a contag .,a contag is fingerted by a sidx .,the mayor kissed the minister .,the minister was kissed by the mayor .
a canv contamined a siph .,a siph was contamined by a canv .,the minister kisses the mother .,the mother is kissed by the minister .
the neurot depls the mism .,the mism is depled by the neurot .,a mother kissed a nurse .,a nurse was kissed by a mother .
the consecut calibed the cripp .,the cripp was calibed by the consecut .,a nurse kisses a parent .,a parent is kissed by a nurse .
an accommod handcs an ausp .,an ausp is handced by an accommod .,the parent kissed the partner .,the partner was kissed by the parent .
an abbre calibed a sidx .,a sidx was calibed by an abbre .,the partner kisses the physician .,the physician is kissed by the partner .
the hairst helicops the bacter .,the bacter is helicoped by the hairst .,a physician kissed a pilot .,a pilot was kissed by a physician .
the cryptoc contraded the burgl .,the burgl was contraded by the cryptoc .,a pilot kisses a president .,a president is kissed by a pilot .
a commemor ethns a chimpan .,a chimpan is ethned by a commemor .,the president kissed the priest .,the priest was kissed by the president .
a malf ferved a disg .,a disg was ferved by a malf .,the priest kisses the prince .,the prince is kissed by the priest .
the neurot subters the mism .,the mism is subtered by the neurot .,a prince kissed a princess .,a princess was kissed by a prince .
the attribut fingerted the extrater .,the extrater was fingerted by the attribut .,a princess kisses a professor .,a professor is kissed by a princess .
a microbi multifs a femin .,a femin is multifed by a microbi .,the professor kissed the reader .,the reader was kissed by the professor .
a malf ethned a disg .,a disg was ethned by a malf .,the reader kisses the scientist .,the scientist is kissed by the reader .
the burgl multifs the certific .,the certific is multifed by the burgl .,a scientist kissed a secretary .,a secretary was kissed by a scientist .
the admon clusted the astroph .,the astroph was clusted by the admon .,a secretary kisses a sheriff .,a sheriff is kissed by a secretary .
a commemor impovers a chimpan .,a chimpan is impovered by a commemor .,the sheriff kissed the singer .,the singer was kissed by the sheriff .
an abund sulfed an accommod .,an accommod was sulfed by an abund .,the singer kisses the soldier .,the soldier is kissed by the singer .
the congreg biomarks the simultane .,the simultane is biomarked by the congreg .,a soldier kissed a son .,a son was kissed by a soldier .
the cryptoc sulfed the burgl .,the burgl was sulfed by the cryptoc .,a son kisses a student .,a student is kissed by a son .
a dilig carnivs a whistlebl .,a whistlebl is carnived by a dilig .,the student kissed the teacher .,the teacher was kissed by the student .
a neglig calibred a dissu .,a dissu was calibred by a neglig .,the teacher kisses the uncle .,the uncle is kissed by the teacher .
the cripp depls the fluct .,the fluct is depled by the cripp .,an uncle kissed a wife .,a wife was kissed by an uncle .
the cryptoc multifed the burgl .,the burgl was multifed by the cryptoc .,a wife kisses a winner .,a winner is kissed by a wife .
a carcin handcs an attribut .,an attribut is handced by a carcin .,the winner kissed the woman .,the woman was kissed by the winner .
an abund depled an accommod .,an accommod was depled by an abund .,the woman kisses the worker .,the worker is kissed by the woman .
the gluc carnivs the malf .,the malf is carnived by the gluc .,a worker kissed a writer .,a writer was kissed by a worker .
the contag multifed the disag .,the disag was multifed by the contag .,a writer kisses an actor .,an actor is kissed by a writer .
a coer reapps a cryptoc .,a cryptoc is reapped by a coer .,the actor protected the actress .,the actress was protected by the actor .
a disqual multifed a neoc .,a neoc was multifed by a disqual .,the actress protects the adult .,the adult is protected by the actress .
the disreg celebrs the disqual .,the disqual is celebred by the disreg .,an adult protected an attorney .,an attorney was protected by an adult .
the contag fingerted the disag .,the disag was fingerted by the contag .,an attorney protects an aunt .,an aunt is protected by an attorney .
an accommod fingerts an ausp .,an ausp is fingerted by an accommod .,the aunt protected the author .,the author was protected by the aunt .
a certific murmed a conting .,a conting was murmed by a certific .,the author protects the bishop .,the bishop is protected by the author .
the disag goalts the detrim .,the detrim is goalted by the disag .,a bishop protected a boy .,a boy was protected by a bishop .
the jurisd subtered the congreg .,the congreg was subtered by the jurisd .,a boy protects a brother .,a brother is protected by a boy .
a carcin discls an attribut .,an attribut is discled by a carcin .,the brother protected the buddy .,the buddy was protected by the brother .
a canv mosquited a siph .,a siph was mosquited by a canv .,the buddy protects the candidate .,the candidate is protected by the buddy .
the membr fingerts the canv .,the canv is fingerted by the membr .,a candidate protected a captain .,a captain was protected by a candidate .
the pedd celebred the barric .,the barric was celebred by the pedd .,a captain protects a champion .,a champion is protected by a captain .
a dilig goalts a whistlebl .,a whistlebl is goalted by a dilig .,the champion protected the chief .,the chief was protected by the champion .
an abund contraded an accommod .,an accommod was contraded by an abund .,the chief protects the child .,the child is protected by the chief .
the extrater hambs the surrog .,the surrog is hambed by the extrater .,a child protected a colonel .,a colonel was protected by a child .
the chimpan dupled the disreg .,the disreg was dupled by the chimpan .,a colonel protects a cop .,a cop is protected by a colonel .
a consolid veterins a predomin .,a predomin is veterined by a consolid .,the cop protected the cousin .,the cousin was protected by the cop .
a fluct filibed a kilomet .,a kilomet was filibed by a fluct .,the cousin protects the daughter .,the daughter is protected by the cousin .
the conspic dupls the abbre .,the abbre is dupled by the conspic .,a daughter protected a doctor .,a doctor was protected by a daughter .
the ausp contamined the outper .,the outper was contamined by the ausp .,a doctor protects an employee .,an employee is protected by a doctor .
a kilomet helicops a pedd .,a pedd is helicoped by a kilomet .,the employee protected the employer .,the employer was protected by the employee .
a surrog murmed a chirop .,a chirop was murmed by a surrog .,the employer protects the father .,the father is protected by the employer .
the astroph goalts the abund .,the abund is goalted by the astroph .,a father protected a friend .,a friend was protected by a father .
the chimpan smired the disreg .,the disreg was smired by the chimpan .,a friend protects a girl .,a girl is protected by a friend .
an accommod indiscrims an ausp .,an ausp is indiscrimed by an accommod .,the girl protected the guest .,the guest was protected by the girl .
a malf carnived a disg .,a disg was carnived by a malf .,the guest protects the guy .,the guy is protected by the guest .
the hairst dupls the bacter .,the bacter is dupled by the hairst .,a guy protected a hero .,a hero was protected by a guy .
the davidjl helicoped the conspic .,the conspic was helicoped by the davidjl .,a hero protects a husband .,a husband is protected by a hero .
an accommod filibs an ausp .,an ausp is filibed by an accommod .,the husband protected the kid .,the kid was protected by the husband .
a certific hambed a conting .,a conting was hambed by a certific .,the kid protects the king .,the king is protected by the kid .
the gluc worshs the malf .,the malf is worshed by the gluc .,a king protected a lady .,a lady was protected by a king .
the dispers multifed the gluc .,the gluc was multifed by the dispers .,a lady protects a lawyer .,a lawyer is protected by a lady .
a carcin reapps an attribut .,an attribut is reapped by a carcin .,the lawyer protected the leader .,the leader was protected by the lawyer .
a mism contamined a microbi .,a microbi was contamined by a mism .,the leader protects the man .,the man is protected by the leader .
the hairst calibrs the bacter .,the bacter is calibred by the hairst .,a man protected a manager .,a manager was protected by a man .
the consecut carnived the cripp .,the cripp was carnived by the consecut .,a manager protects a mayor .,a mayor is protected by a manager .
a microbi calibs a femin .,a femin is calibed by a microbi .,the mayor protected the minister .,the minister was protected by the mayor .
a fluct fingerted a kilomet .,a kilomet was fingerted by a fluct .,the minister protects the mother .,the mother is protected by the minister .
the cripp hambs the fluct .,the fluct is hambed by the cripp .,a mother protected a nurse .,a nurse was protected by a mother .
the pedd nonded the barric .,the barric was nonded by the pedd .,a nurse protects a parent .,a parent is protected by a nurse .
a sidx filibs a contag .,a contag is filibed by a sidx .,the parent protected the partner .,the partner was protected by the parent .
a neglig handced a dissu .,a dissu was handced by a neglig .,the partner protects the physician .,the physician is protected by the partner .
the membr celebrs the canv .,the canv is celebred by the membr .,a physician protected a pilot .,a pilot was protected by a physician .
the dispers sulfed the gluc .,the gluc was sulfed by the dispers .,a pilot protects a president .,a president is protected by a pilot .
a chirop discls a nont .,a nont is discled by a chirop .,the president protected the priest .,the priest was protected by the president .
a surrog nonded a chirop .,a chirop was nonded by a surrog .,the priest protects the prince .,the prince is protected by the priest .
the gluc multifs the malf .,the malf is multifed by the gluc .,a prince protected a princess .,a princess was protected by a prince .
the predomin calibed the disbel .,the disbel was calibed by the predomin .,a princess protects a professor .,a professor is protected by a princess .
a coer smirs a cryptoc .,a cryptoc is smired by a coer .,the professor protected the reader .,the reader was protected by the professor .
an abbre hambed a sidx .,a sidx was hambed by an abbre .,the reader protects the scientist .,the scientist is protected by the reader .
the disag veterins the detrim .,the detrim is veterined by the disag .,a scientist protected a secretary .,a secretary was protected by a scientist .
the ausp biomarked the outper .,the outper was biomarked by the ausp .,a secretary protects a sheriff .,a sheriff is protected by a secretary .
a disg impovers a confid .,a confid is impovered by a disg .,the sheriff protected the singer .,the singer was protected by the sheriff .
a restruct nonded a carcin .,a carcin was nonded by a restruct .,the singer protects the soldier .,the soldier is protected by the singer .
the membr murms the canv .,the canv is murmed by the membr .,a soldier protected a son .,a son was protected by a soldier .
the femin hambed the collabor .,the collabor was hambed by the femin .,a son protects a student .,a student is protected by a son .
a disg nonds a confid .,a confid is nonded by a disg .,the student protected the teacher .,the teacher was protected by the student .
a fluct indiscrimed a kilomet .,a kilomet was indiscrimed by a fluct .,the teacher protects the uncle .,the uncle is protected by the teacher .
the conspic worshs the abbre .,the abbre is worshed by the conspic .,an uncle protected a wife .,a wife was protected by an uncle .
the jurisd ferved the congreg .,the congreg was ferved by the jurisd .,a wife protects a winner .,a winner is protected by a wife .
a disg handcs a confid .,a confid is handced by a disg .,the winner protected the woman .,the woman was protected by the winner .
a bacter celebred a consolid .,a consolid was celebred by a bacter .,the woman protects the worker .,the worker is protected by the woman .
the gluc biomarks the malf .,the malf is biomarked by the gluc .,a worker protected a writer .,a writer was protected by a worker .
the dispers filibed the gluc .,the gluc was filibed by the dispers .,a writer protects an actor .,an actor is protected by a writer .
a carcin mosquits an attribut .,an attribut is mosquited by a carcin .,the actor punched the actress .,the actress was punched by the actor .
an abund veterined an accommod .,an accommod was veterined by an abund .,the actress punches the adult .,the adult is punched by the actress .
the hairst ethns the bacter .,the bacter is ethned by the hairst .,an adult punched an attorney .,an attorney was punched by an adult .
the ausp sulfed the outper .,the outper was sulfed by the ausp .,an attorney punches an aunt .,an aunt is punched by an attorney .
a carcin murms an attribut .,an attribut is murmed by a carcin .,the aunt punched the author .,the author was punched by the aunt .
a malf filibed a disg .,a disg was filibed by a malf .,the author punches the bishop .,the bishop is punched by the author .
the disag helicops the detrim .,the detrim is helicoped by the disag .,a bishop punched a boy .,a boy was punched by a bishop .
the chimpan impovered the disreg .,the disreg was impovered by the chimpan .,a boy punches a brother .,a brother is punched by a boy .
a predec indiscrims an admon .,an admon is indiscrimed by a predec .,the brother punched the buddy .,the buddy was punched by the brother .
an abbre murmed a sidx .,a sidx was murmed by an abbre .,the buddy punches the candidate .,the candidate is punched by the buddy .
the hairst filibs the bacter .,the bacter is filibed by the hairst .,a candidate punched a captain .,a captain was punched by a candidate .
the dispers depled the gluc .,the gluc was depled by the dispers .,a captain punches a champion .,a champion is punched by a captain .
