pa,pp,ta,tp
a wife kisses a winner .,a winner is kissed by a wife .,a hero kisses a husband .,a husband is kissed by a hero .
a writer describes an actor .,an actor is described by a writer .,a lady describes a lawyer .,a lawyer is described by a lady .
a captain forgives a champion .,a champion is forgiven by a captain .,a physician forgives a pilot .,a pilot is forgiven by a physician .
a man kisses a manager .,a manager is kissed by a man .,an actress kisses an adult .,an adult is kissed by an actress .
a winner grabs a woman .,a woman is grabbed by a winner .,a husband grabs a kid .,a kid is grabbed by a husband .
a priest joins a prince .,a prince is joined by a priest .,a chief joins a child .,a child is joined by a chief .
a winner raises a woman .,a woman is raised by a winner .,a husband raises a kid .,a kid is raised by a husband .
an employee chases an employer .,an employer is chased by an employee .,a secretary chases a sheriff .,a sheriff is chased by a secretary .
a buddy follows a candidate .,a candidate is followed by a buddy .,a parent follows a partner .,a partner is followed by a parent .
a princess selects a professor .,a professor is selected by a princess .,a colonel selects a cop .,a cop is selected by a colonel .
a minister beats a mother .,a mother is beaten by a minister .,an aunt beats an author .,an author is beaten by an aunt .
a husband forgets a kid .,a kid is forgotten by a husband .,a wife forgets a winner .,a winner is forgotten by a wife .
a doctor asks an employee .,an employee is asked by a doctor .,a scientist asks a secretary .,a secretary is asked by a scientist .
a daughter chases a doctor .,a doctor is chased by a daughter .,a reader chases a scientist .,a scientist is chased by a reader .
a pilot hurries a president .,a president is hurried by a pilot .,a captain hurries a champion .,a champion is hurried by a captain .
a parent kisses a partner .,a partner is kissed by a parent .,a brother kisses a buddy .,a buddy is kissed by a brother .
a guy forgets a hero .,a hero is forgotten by a guy .,a teacher forgets an uncle .,an uncle is forgotten by a teacher .
a kid catches a king .,a king is caught by a kid .,a winner catches a woman .,a woman is caught by a winner .
an employer comforts a father .,a father is comforted by an employer .,a sheriff comforts a singer .,a singer is comforted by a sheriff .
an actress strikes an adult .,an adult is struck by an actress .,a leader strikes a man .,a man is struck by a leader .
a brother forgives a buddy .,a buddy is forgiven by a brother .,an opponent forgives a parent .,a parent is forgiven by an opponent .
an aunt teaches an author .,an author is taught by an aunt .,a mayor teaches a minister .,a minister is taught by a mayor .
a king protects a lady .,a lady is protected by a king .,a woman protects a worker .,a worker is protected by a woman .
a leader judges a man .,a man is judged by a leader .,an actor judges an actress .,an actress is judged by an actor .
a teacher catches an uncle .,an uncle is caught by a teacher .,a guest catches a guy .,a guy is caught by a guest .
a mayor helps a minister .,a minister is helped by a mayor .,an attorney helps an aunt .,an aunt is helped by an attorney .
a bishop embraces a boy .,a boy is embraced by a bishop .,a mother embraces a nurse .,a nurse is embraced by a mother .
a mayor understands a minister .,a minister is understood by a mayor .,an attorney understands an aunt .,an aunt is understood by an attorney .
a child carries a colonel .,a colonel is carried by a child .,a priest carries a prince .,a prince is carried by a priest .
a woman catches a worker .,a worker is caught by a woman .,a kid catches a king .,a king is caught by a kid .
a king raises a lady .,a lady is raised by a king .,a woman raises a worker .,a worker is raised by a woman .
a secretary selects a sheriff .,a sheriff is selected by a secretary .,a doctor selects an employee .,an employee is selected by a doctor .
a secretary surprises a sheriff .,a sheriff is surprised by a secretary .,a doctor surprises an employee .,an employee is surprised by a doctor .
a priest comforts a prince .,a prince is comforted by a priest .,a chief comforts a child .,a child is comforted by a chief .
a chief drags a child .,a child is dragged by a chief .,a president drags a priest .,a priest is dragged by a president .
a minister chases a mother .,a mother is chased by a minister .,an aunt chases an author .,an author is chased by an aunt .
a leader beats a man .,a man is beaten by a leader .,an actor beats an actress .,an actress is beaten by an actor .
a cop bothers a cousin .,a cousin is bothered by a cop .,a princess bothers a professor .,a professor is bothered by a princess .
a prince washes a princess .,a princess is washed by a prince .,a child washes a colonel .,a colonel is washed by a child .
a colonel washes a cop .,a cop is washed by a colonel .,a prince washes a princess .,a princess is washed by a prince .
a professor judges a reader .,a reader is judged by a professor .,a cop judges a cousin .,a cousin is judged by a cop .
a winner selects a woman .,a woman is selected by a winner .,a husband selects a kid .,a kid is selected by a husband .
a reader follows a scientist .,a scientist is followed by a reader .,a cousin follows a daughter .,a daughter is followed by a cousin .
a priest discovers a prince .,a prince is discovered by a priest .,a chief discovers a child .,a child is discovered by a chief .
a guy judges a hero .,a hero is judged by a guy .,a teacher judges an uncle .,an uncle is judged by a teacher .
a cousin embraces a daughter .,a daughter is embraced by a cousin .,a professor embraces a reader .,a reader is embraced by a professor .
a buddy chases a candidate .,a candidate is chased by a buddy .,a parent chases a partner .,a partner is chased by a parent .
a princess washes a professor .,a professor is washed by a princess .,a colonel washes a cop .,a cop is washed by a colonel .
a candidate chases a captain .,a captain is chased by a candidate .,a partner chases a physician .,a physician is chased by a partner .
a soldier hurts a son .,a son is hurt by a soldier .,a father hurts a friend .,a friend is hurt by a father .
a man chases a manager .,a manager is chased by a man .,an actress chases an adult .,an adult is chased by an actress .
an actor raises an actress .,an actress is raised by an actor .,a lawyer raises a leader .,a leader is raised by a lawyer .
a scientist bothers a secretary .,a secretary is bothered by a scientist .,a daughter bothers a doctor .,a doctor is bothered by a daughter .
a woman forgives a worker .,a worker is forgiven by a woman .,a kid forgives a king .,a king is forgiven by a kid .
a prince raises a princess .,a princess is raised by a prince .,a child raises a colonel .,a colonel is raised by a child .
a singer grabs a soldier .,a soldier is grabbed by a singer .,an employer grabs a father .,a father is grabbed by an employer .
an actress grabs an adult .,an adult is grabbed by an actress .,a leader grabs a man .,a man is grabbed by a leader .
a guy washes a hero .,a hero is washed by a guy .,a teacher washes an uncle .,an uncle is washed by a teacher .
a worker understands a writer .,a writer is understood by a worker .,a king understands a lady .,a lady is understood by a king .
a secretary bothers a sheriff .,a sheriff is bothered by a secretary .,a doctor bothers an employee .,an employee is bothered by a doctor .
a student catches a teacher .,a teacher is caught by a student .,a girl catches a guest .,a guest is caught by a girl .
a mayor hurries a minister .,a minister is hurried by a mayor .,an attorney hurries an aunt .,an aunt is hurried by an attorney .
a bishop punches a boy .,a boy is punched by a bishop .,a mother punches a nurse .,a nurse is punched by a mother .
an author selects a bishop .,a bishop is selected by an author .,a minister selects a mother .,a mother is selected by a minister .
a captain hurries a champion .,a champion is hurried by a captain .,a physician hurries a pilot .,a pilot is hurried by a physician .
a cop washes a cousin .,a cousin is washed by a cop .,a princess washes a professor .,a professor is washed by a princess .
a singer bothers a soldier .,a soldier is bothered by a singer .,an employer bothers a father .,a father is bothered by an employer .
a soldier joins a son .,a son is joined by a soldier .,a father joins a friend .,a friend is joined by a father .
a father catches a friend .,a friend is caught by a father .,a singer catches a soldier .,a soldier is caught by a singer .
a worker hurts a writer .,a writer is hurt by a worker .,a king hurts a lady .,a lady is hurt by a king .
a student forgives a teacher .,a teacher is forgiven by a student .,a girl forgives a guest .,a guest is forgiven by a girl .
an employer grabs a father .,a father is grabbed by an employer .,a sheriff grabs a singer .,a singer is grabbed by a sheriff .
a parent helps a partner .,a partner is helped by a parent .,a brother helps a buddy .,a buddy is helped by a brother .
a soldier comforts a son .,a son is comforted by a soldier .,a father comforts a friend .,a friend is comforted by a father .
an opponent understands a parent .,a parent is understood by an opponent .,a boy understands a brother .,a brother is understood by a boy .
a pilot kills a president .,a president is killed by a pilot .,a captain kills a champion .,a champion is killed by a captain .
an actress hurries an adult .,an adult is hurried by an actress .,a leader hurries a man .,a man is hurried by a leader .
a winner embraces a woman .,a woman is embraced by a winner .,a husband embraces a kid .,a kid is embraced by a husband .
a captain strikes a champion .,a champion is struck by a captain .,a physician strikes a pilot .,a pilot is struck by a physician .
a writer carries an actor .,an actor is carried by a writer .,a lady carries a lawyer .,a lawyer is carried by a lady .
an employer forgets a father .,a father is forgotten by an employer .,a sheriff forgets a singer .,a singer is forgotten by a sheriff .
a prince kills a princess .,a princess is killed by a prince .,a child kills a colonel .,a colonel is killed by a child .
a president kills a priest .,a priest is killed by a president .,a champion kills a chief .,a chief is killed by a champion .
a friend carries a girl .,a girl is carried by a friend .,a soldier carries a son .,a son is carried by a soldier .
a doctor discovers an employee .,an employee is discovered by a doctor .,a scientist discovers a secretary .,a secretary is discovered by a scientist .
an aunt asks an author .,an author is asked by an aunt .,a mayor asks a minister .,a minister is asked by a mayor .
a winner destroys a woman .,a woman is destroyed by a winner .,a husband destroys a kid .,a kid is destroyed by a husband .
a champion hurts a chief .,a chief is hurt by a champion .,a pilot hurts a president .,a president is hurt by a pilot .
a president punches a priest .,a priest is punched by a president .,a champion punches a chief .,a chief is punched by a champion .
a cousin teaches a daughter .,a daughter is taught by a cousin .,a professor teaches a reader .,a reader is taught by a professor .
a prince joins a princess .,a princess is joined by a prince .,a child joins a colonel .,a colonel is joined by a child .
a candidate grabs a captain .,a captain is grabbed by a candidate .,a partner grabs a physician .,a physician is grabbed by a partner .
a man punches a manager .,a manager is punched by a man .,an actress punches an adult .,an adult is punched by an actress .
a secretary discovers a sheriff .,a sheriff is discovered by a secretary .,a doctor discovers an employee .,an employee is discovered by a doctor .
a colonel hurts a cop .,a cop is hurt by a colonel .,a prince hurts a princess .,a princess is hurt by a prince .
a kid judges a king .,a king is judged by a kid .,a winner judges a woman .,a woman is judged by a winner .
a princess hurries a professor .,a professor is hurried by a princess .,a colonel hurries a cop .,a cop is hurried by a colonel .
a winner chases a woman .,a woman is chased by a winner .,a husband chases a kid .,a kid is chased by a husband .
a king asks a lady .,a lady is asked by a king .,a woman asks a worker .,a worker is asked by a woman .
a father protects a friend .,a friend is protected by a father .,a singer protects a soldier .,a soldier is protected by a singer .
an adult selects an attorney .,an attorney is selected by an adult .,a man selects a manager .,a manager is selected by a man .
a manager comforts a mayor .,a mayor is comforted by a manager .,an adult comforts an attorney .,an attorney is comforted by an adult .
a mother bothers a nurse .,a nurse is bothered by a mother .,an author bothers a bishop .,a bishop is bothered by an author .
an author follows a bishop .,a bishop is followed by an author .,a minister follows a mother .,a mother is followed by a minister .
a father selects a friend .,a friend is selected by a father .,a singer selects a soldier .,a soldier is selected by a singer .
a kid kisses a king .,a king is kissed by a kid .,a winner kisses a woman .,a woman is kissed by a winner .
a woman drags a worker .,a worker is dragged by a woman .,a kid drags a king .,a king is dragged by a kid .
a girl chases a guest .,a guest is chased by a girl .,a son chases a student .,a student is chased by a son .
a son judges a student .,a student is judged by a son .,a friend judges a girl .,a girl is judged by a friend .
a minister forgets a mother .,a mother is forgotten by a minister .,an aunt forgets an author .,an author is forgotten by an aunt .
a mayor punches a minister .,a minister is punched by a mayor .,an attorney punches an aunt .,an aunt is punched by an attorney .
a reader hurts a scientist .,a scientist is hurt by a reader .,a cousin hurts a daughter .,a daughter is hurt by a cousin .
a manager surprises a mayor .,a mayor is surprised by a manager .,an adult surprises an attorney .,an attorney is surprised by an adult .
a hero forgives a husband .,a husband is forgiven by a hero .,an uncle forgives a wife .,a wife is forgiven by an uncle .
a brother forgets a buddy .,a buddy is forgotten by a brother .,an opponent forgets a parent .,a parent is forgotten by an opponent .
a friend understands a girl .,a girl is understood by a friend .,a soldier understands a son .,a son is understood by a soldier .
an employer punches a father .,a father is punched by an employer .,a sheriff punches a singer .,a singer is punched by a sheriff .
an adult joins an attorney .,an attorney is joined by an adult .,a man joins a manager .,a manager is joined by a man .
a singer judges a soldier .,a soldier is judged by a singer .,an employer judges a father .,a father is judged by an employer .
a husband follows a kid .,a kid is followed by a husband .,a wife follows a winner .,a winner is followed by a wife .
a child kisses a colonel .,a colonel is kissed by a child .,a priest kisses a prince .,a prince is kissed by a priest .
a pilot describes a president .,a president is described by a pilot .,a captain describes a champion .,a champion is described by a captain .
a winner helps a woman .,a woman is helped by a winner .,a husband helps a kid .,a kid is helped by a husband .
a pilot discovers a president .,a president is discovered by a pilot .,a captain discovers a champion .,a champion is discovered by a captain .
an uncle bothers a wife .,a wife is bothered by an uncle .,a guy bothers a hero .,a hero is bothered by a guy .
a bishop follows a boy .,a boy is followed by a bishop .,a mother follows a nurse .,a nurse is followed by a mother .
a friend comforts a girl .,a girl is comforted by a friend .,a soldier comforts a son .,a son is comforted by a soldier .
a mother comforts a nurse .,a nurse is comforted by a mother .,an author comforts a bishop .,a bishop is comforted by an author .
a child embraces a colonel .,a colonel is embraced by a child .,a priest embraces a prince .,a prince is embraced by a priest .
a president bothers a priest .,a priest is bothered by a president .,a champion bothers a chief .,a chief is bothered by a champion .
a nurse teaches an opponent .,an opponent is taught by a nurse .,a bishop teaches a boy .,a boy is taught by a bishop .
a priest forgets a prince .,a prince is forgotten by a priest .,a chief forgets a child .,a child is forgotten by a chief .
a winner discovers a woman .,a woman is discovered by a winner .,a husband discovers a kid .,a kid is discovered by a husband .
a father drags a friend .,a friend is dragged by a father .,a singer drags a soldier .,a soldier is dragged by a singer .
a candidate destroys a captain .,a captain is destroyed by a candidate .,a partner destroys a physician .,a physician is destroyed by a partner .
a minister drags a mother .,a mother is dragged by a minister .,an aunt drags an author .,an author is dragged by an aunt .
a professor comforts a reader .,a reader is comforted by a professor .,a cop comforts a cousin .,a cousin is comforted by a cop .
an attorney follows an aunt .,an aunt is followed by an attorney .,a manager follows a mayor .,a mayor is followed by a manager .
a worker chases a writer .,a writer is chased by a worker .,a king chases a lady .,a lady is chased by a king .
a writer hurts an actor .,an actor is hurt by a writer .,a lady hurts a lawyer .,a lawyer is hurt by a lady .
a sheriff discovers a singer .,a singer is discovered by a sheriff .,an employee discovers an employer .,an employer is discovered by an employee .
a husband kisses a kid .,a kid is kissed by a husband .,a wife kisses a winner .,a winner is kissed by a wife .
a winner strikes a woman .,a woman is struck by a winner .,a husband strikes a kid .,a kid is struck by a husband .
a priest kills a prince .,a prince is killed by a priest .,a chief kills a child .,a child is killed by a chief .
a partner judges a physician .,a physician is judged by a partner .,a buddy judges a candidate .,a candidate is judged by a buddy .
a teacher forgets an uncle .,an uncle is forgotten by a teacher .,a guest forgets a guy .,a guy is forgotten by a guest .
a candidate washes a captain .,a captain is washed by a candidate .,a partner washes a physician .,a physician is washed by a partner .
a writer selects an actor .,an actor is selected by a writer .,a lady selects a lawyer .,a lawyer is selected by a lady .
a scientist helps a secretary .,a secretary is helped by a scientist .,a daughter helps a doctor .,a doctor is helped by a daughter .
a candidate forgives a captain .,a captain is forgiven by a candidate .,a partner forgives a physician .,a physician is forgiven by a partner .
a buddy strikes a candidate .,a candidate is struck by a buddy .,a parent strikes a partner .,a partner is struck by a parent .
a princess joins a professor .,a professor is joined by a princess .,a colonel joins a cop .,a cop is joined by a colonel .
a doctor grabs an employee .,an employee is grabbed by a doctor .,a scientist grabs a secretary .,a secretary is grabbed by a scientist .
an author embraces a bishop .,a bishop is embraced by an author .,a minister embraces a mother .,a mother is embraced by a minister .
a reader carries a scientist .,a scientist is carried by a reader .,a cousin carries a daughter .,a daughter is carried by a cousin .
a lawyer judges a leader .,a leader is judged by a lawyer .,a writer judges an actor .,an actor is judged by a writer .
a champion raises a chief .,a chief is raised by a champion .,a pilot raises a president .,a president is raised by a pilot .
a princess punches a professor .,a professor is punched by a princess .,a colonel punches a cop .,a cop is punched by a colonel .
a guy describes a hero .,a hero is described by a guy .,a teacher describes an uncle .,an uncle is described by a teacher .
an author punches a bishop .,a bishop is punched by an author .,a minister punches a mother .,a mother is punched by a minister .
a writer asks an actor .,an actor is asked by a writer .,a lady asks a lawyer .,a lawyer is asked by a lady .
a brother chases a buddy .,a buddy is chased by a brother .,an opponent chases a parent .,a parent is chased by an opponent .
a chief judges a child .,a child is judged by a chief .,a president judges a priest .,a priest is judged by a president .
a soldier bothers a son .,a son is bothered by a soldier .,a father bothers a friend .,a friend is bothered by a father .
a student beats a teacher .,a teacher is beaten by a student .,a girl beats a guest .,a guest is beaten by a girl .
a doctor helps an employee .,an employee is helped by a doctor .,a scientist helps a secretary .,a secretary is helped by a scientist .
a colonel chases a cop .,a cop is chased by a colonel .,a prince chases a princess .,a princess is chased by a prince .
a child asks a colonel .,a colonel is asked by a child .,a priest asks a prince .,a prince is asked by a priest .
a winner joins a woman .,a woman is joined by a winner .,a husband joins a kid .,a kid is joined by a husband .
a manager washes a mayor .,a mayor is washed by a manager .,an adult washes an attorney .,an attorney is washed by an adult .
a cop judges a cousin .,a cousin is judged by a cop .,a princess judges a professor .,a professor is judged by a princess .
a kid selects a king .,a king is selected by a kid .,a winner selects a woman .,a woman is selected by a winner .
a man washes a manager .,a manager is washed by a man .,an actress washes an adult .,an adult is washed by an actress .
a physician asks a pilot .,a pilot is asked by a physician .,a candidate asks a captain .,a captain is asked by a candidate .
a partner describes a physician .,a physician is described by a partner .,a buddy describes a candidate .,a candidate is described by a buddy .
an actress chases an adult .,an adult is chased by an actress .,a leader chases a man .,a man is chased by a leader .
an author judges a bishop .,a bishop is judged by an author .,a minister judges a mother .,a mother is judged by a minister .
a secretary judges a sheriff .,a sheriff is judged by a secretary .,a doctor judges an employee .,an employee is judged by a doctor .
a secretary follows a sheriff .,a sheriff is followed by a secretary .,a doctor follows an employee .,an employee is followed by a doctor .
a child forgets a colonel .,a colonel is forgotten by a child .,a priest forgets a prince .,a prince is forgotten by a priest .
a doctor raises an employee .,an employee is raised by a doctor .,a scientist raises a secretary .,a secretary is raised by a scientist .
a secretary drags a sheriff .,a sheriff is dragged by a secretary .,a doctor drags an employee .,an employee is dragged by a doctor .
a professor destroys a reader .,a reader is destroyed by a professor .,a cop destroys a cousin .,a cousin is destroyed by a cop .
a king comforts a lady .,a lady is comforted by a king .,a woman comforts a worker .,a worker is comforted by a woman .
a candidate embraces a captain .,a captain is embraced by a candidate .,a partner embraces a physician .,a physician is embraced by a partner .
a scientist surprises a secretary .,a secretary is surprised by a scientist .,a daughter surprises a doctor .,a doctor is surprised by a daughter .
a sheriff catches a singer .,a singer is caught by a sheriff .,an employee catches an employer .,an employer is caught by an employee .
a king helps a lady .,a lady is helped by a king .,a woman helps a worker .,a worker is helped by a woman .
an employer joins a father .,a father is joined by an employer .,a sheriff joins a singer .,a singer is joined by a sheriff .
a prince embraces a princess .,a princess is embraced by a prince .,a child embraces a colonel .,a colonel is embraced by a child .
a guest understands a guy .,a guy is understood by a guest .,a student understands a teacher .,a teacher is understood by a student .
a scientist hurries a secretary .,a secretary is hurried by a scientist .,a daughter hurries a doctor .,a doctor is hurried by a daughter .
a worker strikes a writer .,a writer is struck by a worker .,a king strikes a lady .,a lady is struck by a king .
a physician joins a pilot .,a pilot is joined by a physician .,a candidate joins a captain .,a captain is joined by a candidate .
an employer drags a father .,a father is dragged by an employer .,a sheriff drags a singer .,a singer is dragged by a sheriff .
a boy beats a brother .,a brother is beaten by a boy .,a nurse beats an opponent .,an opponent is beaten by a nurse .
a lady punches a lawyer .,a lawyer is punched by a lady .,a worker punches a writer .,a writer is punched by a worker .
an opponent raises a parent .,a parent is raised by an opponent .,a boy raises a brother .,a brother is raised by a boy .
a worker surprises a writer .,a writer is surprised by a worker .,a king surprises a lady .,a lady is surprised by a king .
a chief hurts a child .,a child is hurt by a chief .,a president hurts a priest .,a priest is hurt by a president .
an employee selects an employer .,an employer is selected by an employee .,a secretary selects a sheriff .,a sheriff is selected by a secretary .
a worker forgets a writer .,a writer is forgotten by a worker .,a king forgets a lady .,a lady is forgotten by a king .
a scientist comforts a secretary .,a secretary is comforted by a scientist .,a daughter comforts a doctor .,a doctor is comforted by a daughter .
an adult forgives an attorney .,an attorney is forgiven by an adult .,a man forgives a manager .,a manager is forgiven by a man .
a woman follows a worker .,a worker is followed by a woman .,a kid follows a king .,a king is followed by a kid .
